357577,35.109833,-114.612887, Rita's Fabrics  Shopping  Crafts & Fabrics  shop sewing   Retail Goods 
357587,32.68687,-114.606805, Arg Contractor  Building & Trades  Construction  contractor   Services 
357603,35.126708,-114.576782, Pat's Tire & Automotive  Retail  Auto Repair  repairing automobile   Services 
357649,34.475363,-114.327944, Rose Of Sharon Medical Svc  Shopping    wheel chair scooter   Retail Goods 
357661,32.686624,-114.63323, Ideal Jewelers  Shopping  Jewelry  repair   Retail Goods 
357665,35.104125,-114.612933, Rose's Hair Shoppe  Personal  Beauty Salon  church   Services 
357691,34.503298,-114.312758, Scott Steel Erectors  Building & Trades  Construction  steel erection structural   Services 
357836,32.701746,-114.654151, Revolution Ride Shop  Shopping  Bicycles & Sporting Goods  establishment   Retail Goods 
357855,33.766686,-113.610386, Salome Ready Mix  Home & Garden  Building Materials  mixed concrete   Retail Goods 
357881,34.494459,-114.343579, Lakeside Tire & Auto Service  Retail  Auto Repair  repairing automobile tire   Services 
357916,34.150608,-114.282802, General Foods Bakery Co  Food & Beverages  Bakery  baker   Retail Goods 
357922,34.477244,-114.339534, Career Styles Etc  Shopping  Clothing  Apparel  & Fashions  uniform   Retail Goods 
357923,34.459992,-114.319796, Ben Thomas Development Inc  Building & Trades  Construction  general contractor   Services 
357934,35.107965,-114.604845, O 2 Science  Health Services  Clinic  equipment therapy oxygen   Services 
357955,34.507984,-114.338027, Lake Havasu Mortuary  Retail  Funeral Services  director   Services 
357962,34.922978,-114.613206, Elliot Bookkeeping Svc  Professional  Accounting & Tax Preparation  bookkeeping general   Services 
357969,32.692791,-114.613065, Roadway Express  Freight    distance company long trucking   Transportation 
357985,34.507209,-114.346939, Shop Works  Building & Trades  Construction  welding contractor   Services 
358001,35.105738,-114.598088, Lovely Nails  Personal  Beauty Salon  manicuring   Services 
358036,32.698426,-114.627828, J Barry Patterson Architect  Real Estate  Developer  television   Services 
358051,34.475331,-114.322777, US Marine Corps Recruiting  Government  Office  recruiting   Public Place 
358067,34.523906,-114.286707, C & C Remodeling & Repairs  Building & Trades  Construction  house   Services 
358100,34.498792,-114.34785, Chili Charlie's  Restaurant    physician surgeon   Food & Drink 
358138,34.467166,-114.314064, Talk of Town  Wholesale  Jewelry  stone   Manufacturing & Wholesale Goods 
358197,32.719687,-114.640637, Ace Painting  Building & Trades  Construction  hanging contractor   Services 
358202,34.147109,-114.287264, H & R Block Tax Svc  Professional  Accounting & Tax Preparation  return filing   Services 
358204,34.506158,-114.356822, Fine Line Muffler & Detail  Retail  Car Wash  automobile detail clean   Services 
358229,35.219096,-114.178784, Golden Valley Mini Storage  Freight    commercial storage general   Transportation 
358245,34.996956,-114.589104, Fort Mojave Elementary School  Education  School  telecommunication   Public Place 
358251,34.514354,-114.345393, BMR Enterprises  Wholesale  Groceries  physician surgeon   Manufacturing & Wholesale Goods 
358304,34.152972,-114.285735, Eliminator Pest Control  Building & Trades  Pest Control  consultant   Services 
358316,32.572932,-114.649507, Flores Painting  Building & Trades  Construction  hanging contractor   Services 
358352,32.611671,-114.547528, Classic Baby Vegetables  Food & Beverages  Fruits & Vegetables  loan real estate   Retail Goods 
358360,34.493685,-114.350008, Automotive Accessories  Autos & Motor Vehicles  Auto Supplies  automobile parts   Retail Goods 
358373,34.467667,-114.285851, Southwest Desert Magic LLC  Travel  Travel Agent  operator tour   Entertainment 
358376,34.503746,-114.348036, Mohave State Bank  Banks & Credit Unions  Bank  dentist   Services 
358423,34.494376,-114.342134, Tire Mart Inc  Autos & Motor Vehicles  Auto Supplies  machine shop   Retail Goods 
358443,32.674915,-114.650334, State Farm Insurance  Insurance  Insurance Agent  semiconductor equipment devices   Services 
358464,32.683453,-114.509186, West Farming Doug  Farming  Farm  crop general   Manufacturing & Wholesale Goods 
358471,35.090213,-114.608066, Curt's Tile Design  Building & Trades  Construction  tile dealer contractor   Services 
358488,34.462952,-114.325963, Yaras Family Trust  Banks & Credit Unions  Financial Services  trust management   Services 
358501,32.655052,-114.650162, Butterfield Trading Post  Shopping  Gifts & Souvenirs  awning canopy   Retail Goods 
358517,35.257885,-113.957155, Luseaux Laboratories  Manufacturing  Soap  manufacture detergent other   Manufacturing & Wholesale Goods 
358529,35.003519,-114.599891, RLLC Enterprises Inc  Professional    establishment   Services 
358535,32.675467,-114.59891, Barneys Gas Stop  Autos & Motor Vehicles  Fuel & Gas Station  station gasoline   Retail Goods 
358542,32.682662,-114.624552, Advance Cash  Banks & Credit Unions  Bank  personal institution   Services 
358546,34.475597,-114.322465, Michael Reddig Law Office  Professional  Lawyer & Legal Services  attorney   Services 
358547,34.15193,-114.293305, La Paz Awrds Gfts Thngs Frever  Shopping  Gifts & Souvenirs  attorney   Retail Goods 
358555,32.669436,-114.623103, Albertsons 951  Food & Beverages  Groceries & Convenience Stores  supermarket chain   Retail Goods 
358562,32.689416,-114.624626, Xtreme Car Audio  Autos & Motor Vehicles  Auto Supplies  accessory   Retail Goods 
358602,34.506364,-114.340702, Federal Express Corporation  Freight    scheduled courier air truck t operator   Transportation 
358674,32.686173,-114.577912, Brenton Safety Inc  Wholesale  Machinery & Supplies  equipment industrial   Manufacturing & Wholesale Goods 
358696,34.498939,-114.348002, London Bridge Liquor  Food & Beverages  Liquor & Beverages  taping   Retail Goods 
358723,32.671482,-114.650272, Halls General Contractors LLC  Building & Trades  Construction  house   Services 
358754,34.489027,-114.282942, Cellular Warehouse  Utilities  Mobile Phone  equipment cellular   Services 
358755,34.489013,-114.271389, C & T Performance  Autos & Motor Vehicles  Recreational Vehicle Sales  canopy shell truck cap   Retail Goods 
358759,35.217945,-114.0101, Best Value Inn  Travel  Hotels & Motels  loan real estate   Entertainment 
358776,34.490513,-114.316814, Tile Del Sol LLC  Building & Trades  Construction  contractor   Services 
358809,34.993645,-114.597972, Ashley Furniture Homestore  Home & Garden  Furniture  household   Retail Goods 
358816,35.228952,-114.148809, Desert Sunset Trailer Park  Real Estate  Real Estate Operator  mobile home community   Services 
358840,32.711122,-114.625787, Desert Veterinary Clinic  Retail  Veterinary Services  glass replacement   Services 
358881,34.48195,-114.29611, Canyon Landscaping Maintenance  Building & Trades  Landscaping Services  craft   Services 
358897,34.474743,-114.331419, Payday Check Cashing  Banks & Credit Unions  Bank  cashing check   Services 
358933,35.120732,-114.588626, Camera Works Photography  Retail  Portrait Studio  photographer   Services 
358955,35.213145,-114.035005, Mortgage Tree Lending  Banks & Credit Unions  Bank  mortgage   Services 
359021,35.222053,-114.214151, D & G Supply  Wholesale  Farm Supplies  feed   Manufacturing & Wholesale Goods 
359026,34.476044,-114.335691, Wdl Trust II Dted Jnary 1 1998  Banks & Credit Unions  Financial Services  trust management   Services 
359095,34.913219,-114.577642, Quick Drywall  Building & Trades  Construction  dry wall contractor   Services 
359100,32.670062,-114.535864, Second Home Sales  Autos & Motor Vehicles  Recreational Vehicle Sales  perk mobile model home   Retail Goods 
359110,32.60393,-114.615279, Somerton Airport  Manufacturing  Printing  commercial   Manufacturing & Wholesale Goods 
359117,34.477597,-114.334944, Mark S Nexsen CPA  Professional  Accounting & Tax Preparation  accountant   Services 
359120,35.210991,-114.016364, Sarah's House Victim Ctr  Government  Office  semiconductor devices   Public Place 
359180,34.993362,-114.598054, Performance Mini Storage  Real Estate  Real Estate Operator  building storage commercial nonresidential   Services 
359186,35.400326,-113.860919, R Group Architects & Builders  Real Estate  Architect  manicuring   Services 
359196,35.003519,-114.599891, Desert Graphics & Mailings  Manufacturing  Printing  printer   Manufacturing & Wholesale Goods 
359255,32.663094,-114.47171, Bills Backhoe Service  Building & Trades  Plumbing  excavation contractor   Services 
359302,34.471815,-114.310672, Paul M Mc Kosky  Professional  Lawyer & Legal Services  attorney   Services 
359305,35.091406,-114.605998, Arise Inc  Social Services  Job Training  retardation disabled mental dev   Services 
359355,34.474818,-114.325797, Aquastrophics Dive & Travel  Recreation    sporting   Entertainment 
359361,34.146302,-114.286742, Castro Service Ctr  Retail  Auto Repair  repairing automobile   Services 
359388,34.478929,-114.33426, Housing Refurbishment  Professional    establishment   Services 
359452,34.465462,-114.260808, Shugrue's Restaurant Bakery  Restaurant    treatment skin   Food & Drink 
359458,34.156403,-114.294832, Port Of Entry  Government  Office  state program   Public Place 
359488,34.145322,-114.292226, American Red Cross  Organizations  Non-profit Organization  human   Services 
359504,34.141689,-114.291731, Colorado River Ctr-Alternative  Health Services  Doctor  physician surgeon   Services 
359512,34.498792,-114.34785, Madd Tz Sportswear  Wholesale  Apparel  screen t shirt printed   Manufacturing & Wholesale Goods 
359529,34.487837,-114.354652, Puppy Palace Mobile Grooming  Retail  Animal Services  pet grooming washing   Services 
359540,34.45773,-114.281928, Mohave Directv  Shopping  Computers & Home Electronics  equipment satellite system   Retail Goods 
359545,35.010805,-114.598062, Seitz Office City  Shopping  Stationery & Office Supplies  therapist massage   Retail Goods 
359593,35.100642,-114.61084, Bullhead City Head Start  Social Services  Child Care  kindergarten academic school   Services 
359608,32.669387,-114.629862, Dwight D Nelson Investments  Real Estate  Real Estate Operator  building apartment mobile site p home   Services 
359675,32.694915,-114.638348, Gunsho II LLC  Wholesale  Sporting Goods  attorney   Manufacturing & Wholesale Goods 
359676,34.496035,-114.351786, Donut Post  Food & Beverages  Bakery  doughnut   Retail Goods 
359722,32.670167,-114.519556, Windhaven Rv Park  Real Estate  Real Estate Operator  mobile home site   Services 
359739,35.11292,-114.577473, Mohave Electric Cooperative  Utilities  Electric  company   Services 
359740,34.497227,-114.306812, Action Marine  Wholesale  Sporting Goods  company   Manufacturing & Wholesale Goods 
359746,32.659864,-114.624382, Hummingbird  Shopping  Clothing  Apparel  & Fashions  apartment   Retail Goods 
359756,34.499418,-114.342118, Endoro Fabrication  Manufacturing  Motor Vehicles & Parts  truck trailer mfg   Manufacturing & Wholesale Goods 
359765,34.475462,-114.342375, Starbucks  Restaurant    eating   Food & Drink 
359780,34.501279,-114.348026, Health Insurances  Insurance  Health Insurance  carrier   Services 
359793,35.044677,-114.589464, Contractors Financial Svc  Banks & Credit Unions  Bank  loan   Services 
359809,32.69989,-114.659631, Reyes Industrial  Manufacturing  Tools & Machinery  industrial merchandise mfg   Manufacturing & Wholesale Goods 
359813,35.083876,-114.556736, Mountain View Homes  Building & Trades  Construction  general contractor   Services 
359884,32.703087,-114.665208, Ink It Over  Manufacturing  Retail Goods  carbon ribbon mfg   Manufacturing & Wholesale Goods 
359898,34.524138,-114.35589, Times Eight  Shopping  Clothing  Apparel  & Fashions  family   Retail Goods 
359902,34.992227,-114.592491, Kidron Plumbing  Building & Trades  Plumbing  plumbing contractor   Services 
359912,32.705363,-114.624584, Fourth Ave Radiator Service  Wholesale  Auto Parts  repair general   Manufacturing & Wholesale Goods 
359922,32.681931,-114.641828, Julieannas Patio Cafe  Restaurant    eating   Food & Drink 
360019,32.705956,-114.624735, Arizona Lighting Company Yuma  Home & Garden  Home Furnishings  establishment   Retail Goods 
360023,34.521823,-114.344142, At Your Service Homecare  Shopping    merchandise   Retail Goods 
360038,34.502987,-114.350993, River Info  Professional  Computer Services  internet   Services 
360055,32.721052,-114.664934, Desert Flamingo Landscaping  Building & Trades  Landscaping Services  landscape   Services 
360060,34.148874,-114.289935, Curves For Women  Sports & Exercise  Gym  club health studio gymnasium   Entertainment 
360173,34.476413,-114.286035, Lou's Mobile Screen Svc  Home & Garden  Building Materials  screen window   Retail Goods 
360174,32.691603,-114.633251, Wow Electronics  Shopping  Computers & Home Electronics  screen window   Retail Goods 
360177,35.032351,-114.570215, Windsox Co  Shopping    merchandise   Retail Goods 
360192,35.217695,-114.018388, Town & Country Realty  Real Estate  Real Estate Agent  shoes   Services 
360204,34.503065,-114.350779, Chevron  Autos & Motor Vehicles  Fuel & Gas Station  station gasoline   Retail Goods 
360275,34.263329,-114.129517, Riverview Properties  Real Estate  Real Estate Agent  repairing automobile   Services 
360282,34.496233,-114.339912, Havasu Muffler Brake & Lube  Retail  Auto Repair  muffler exhaust system   Services 
360303,32.689307,-114.624626, Tai San Restaurant  Restaurant    chinese   Food & Drink 
360309,34.496155,-114.288552, Filter Motorcar Co  Autos & Motor Vehicles  Automobile Sales  body car used dealer   Retail Goods 
360315,32.721669,-114.650554, Las Palmas Apartments  Real Estate  Real Estate Operator  building apartment   Services 
360320,35.208942,-114.018285, Yellow Cab  Taxi    taxicab   Transportation 
360361,35.188928,-114.055798, The Rose Neon  Manufacturing  Signs  specialty mfg   Manufacturing & Wholesale Goods 
360368,34.493356,-114.299363, Jim's Maintenance  Building & Trades  Landscaping Services  lawn maintenance grounds   Services 
360381,34.482163,-114.287409, Satterwhite Enterprises  Professional  Business Services  drafting   Services 
360444,35.099438,-114.623422, Lili 99 Cents Plus  Shopping  Department Store  shop   Retail Goods 
360465,35.10695,-114.57016, Goldrush Apartments  Real Estate  Real Estate Operator  building apartment   Services 
360512,35.125207,-114.575381, Access Boat & Rv Storage  Recreation  Marina  operation   Entertainment 
360543,32.709229,-114.676488, Rudys Signs  Shopping    merchandise   Retail Goods 
360553,35.19655,-114.074725, Kingman Place Apartments  Real Estate  Real Estate Operator  apartment   Services 
360600,32.6694,-114.6005, Arcamex Avionics Inc  Autos & Motor Vehicles  Automobile Sales  repair avionics equipment   Retail Goods 
360609,32.722606,-114.658974, Tacna Sand & Gravel LLC  Mining & Drilling    construction   Manufacturing & Wholesale Goods 
360621,34.475747,-114.322118, Dana R Stoker Law Office  Professional  Lawyer & Legal Services  attorney   Services 
360626,32.683993,-114.622591, Mattress Warehouse  Home & Garden  Furniture  kindergarten academic school   Retail Goods 
360631,34.498792,-114.34785, Zip 34 Couriers Inc  Freight    water bulk company   Transportation 
360650,35.250336,-114.27586, Ideal Painting & Wall Covering  Building & Trades  Construction  hanging painter contractor   Services 
360709,34.505337,-114.286169, Apollo Systems  Professional  Management & Consulting  consultant telecommunication   Services 
360728,32.700822,-114.663973, Southwest Sales  Utilities  Mobile Phone  telephone cellular   Services 
360848,32.616593,-114.546526, J R P Construction LLC  Building & Trades  Construction  commercial   Services 
360850,34.483172,-114.283003, Buckalew Rental  Real Estate  Real Estate Agent  commercial   Services 
360869,34.503137,-114.347881, American Gel Coat Inc  Manufacturing  Chemicals & Compounds  mfg plastic   Manufacturing & Wholesale Goods 
360880,34.47745,-114.336435, Joint Maneuvers  Health Services  Chiropractor  electrical contractor   Services 
360883,35.120446,-114.590227, Big 5 Sporting Goods  Shopping  Bicycles & Sporting Goods  irrigation sup   Retail Goods 
360920,34.479174,-114.325801, KAKO Development  Building & Trades  Construction  general contractor   Services 
360930,32.696787,-114.650388, Eduardos Mexican Food  Restaurant    eating   Food & Drink 
360934,35.002662,-114.598141, Gray Tigers Realty Inc  Real Estate  Real Estate Agent  payroll   Services 
360939,34.146817,-114.288764, Basha's  Food & Beverages  Groceries & Convenience Stores  grocer   Retail Goods 
360967,35.164249,-114.552573, Airport Traffic Control Tower  Government  Office  control tower   Public Place 
360977,34.481006,-114.261395, Southwest Custom Spas  Shopping    merchandise   Retail Goods 
360999,32.642883,-114.64828, Hector Builder  Building & Trades  Construction  general contractor   Services 
361017,34.461318,-114.293952, Parker Carpet Ctr  Home & Garden  Carpets & Floor Coverings  dealer rug   Retail Goods 
361026,35.010805,-114.598062, HTWT Electric  Building & Trades  Electrical  electric contractor   Services 
361044,35.222198,-114.038795, Advanced Foot & Ankle  Health Services  Podiatrist  equipment   Services 
361045,32.699559,-114.594688, Yuma Electric Motor Pumps  Wholesale  Electrical  equipment merchandise armature   Manufacturing & Wholesale Goods 
361047,32.66132,-114.438472, MJL Constructions Demolitions  Building & Trades  Construction  house   Services 
361094,35.100461,-114.615712, G & L Burgers  Restaurant    telephone cellular   Food & Drink 
361106,34.474229,-114.346757, Adventure Center  Recreation    charter boat   Entertainment 
361112,34.464659,-114.333707, Salco Investments LLC  Banks & Credit Unions  Financial Services  investor   Services 
361115,34.496977,-114.33535, Shutters & More  Home & Garden  Home Furnishings  dating   Retail Goods 
361121,34.497657,-114.345348, American Iron Works  Building & Trades  Construction  ironwork contractor   Services 
361138,34.521398,-114.281795, Burch Masonry  Building & Trades  Construction  masonry contractor   Services 
361146,32.694118,-114.613705, Rural/Metro  Local Transit    passenger   Transportation 
361151,32.699353,-114.581721, Emco Harvesting Co  Farming  Farm & Veterinary Services  marketing labor prep crop contractor   Manufacturing & Wholesale Goods 
361170,35.110795,-114.59803, Party Pizazz  Building & Trades  Equipment Rental  designer landscape   Services 
361183,32.658379,-114.424633, Johnson Woodworks  Manufacturing  Building Materials  mfg   Manufacturing & Wholesale Goods 
361197,34.496097,-114.354204, E & J Auto  Retail  Auto Repair  repairing automobile   Services 
361231,34.98442,-114.571844, Advantage Carpet & Upholstery  Retail  Laundry & Dry Cleaning  cleaners rug carpet   Services 
361277,32.655873,-114.581179, J S Property Management  Real Estate  Real Estate Agent  church   Services 
361317,35.115285,-114.600088, ABC Therapy Counseling Ctr  Health Services  Hospital  mental   Services 
361327,34.473663,-114.315787, Candie's Permanent Cosmetics  Personal  Beauty Salon  merchandise   Services 
361345,34.499995,-114.288185, Arizona Pool Techs  Building & Trades  Construction  coping plastering tiling pool swimming   Services 
361397,34.475851,-114.342062, Northwestern Arizona Invstgtns  Professional  Detective & Security Services  investigator   Services 
361443,32.698607,-114.612183, Shay Oil Company Inc  Autos & Motor Vehicles  Fuel & Gas Station  station gasoline   Retail Goods 
361448,34.550105,-114.337333, River Valley Precast  Manufacturing  Glass & Minerals  concrete product mfg   Manufacturing & Wholesale Goods 
361469,35.190139,-114.059762, Automatic Transmission Rbldrs  Retail  Auto Repair  transmission   Services 
361513,35.246683,-114.011533, Bank Street Thrift Shop  Shopping  Used Merchandise  shop thrift   Retail Goods 
361540,34.496061,-114.343131, Finish Line Flooring  Home & Garden  Carpets & Floor Coverings  dealer rug   Retail Goods 
361576,32.698554,-114.644789, AAA Taxi  Taxi    taxicab   Transportation 
361582,34.47893,-114.321779, New Day School  Social Services  Child Care  kindergarten academic school   Services 
361594,32.701017,-114.650425, El Pappagallo Mexican Rest  Restaurant    mexican   Food & Drink 
361624,35.190011,-114.058521, Curbside Skates  Shopping  Bicycles & Sporting Goods  equipment skateboard   Retail Goods 
361632,35.190235,-114.060919, Wells Fargo  Banks & Credit Unions  Bank  state commercial   Services 
361647,35.144468,-114.568843, Bullhead City Barbers  Personal  Barber  affairs indian   Services 
361649,34.147796,-114.289204, Parker Accounting Svc  Wholesale  Office Equipment  accounting bookkeeping system   Manufacturing & Wholesale Goods 
361659,32.69865,-114.597719, Precision Electric Co Inc  Wholesale  Electrical  equipment rewinding armature   Manufacturing & Wholesale Goods 
361662,35.197879,-114.309049, Deal With It  Shopping  Music  contractor   Retail Goods 
361686,32.685451,-114.633382, Medpark Apartments  Real Estate  Real Estate Operator  building apartment business   Services 
361687,35.049623,-114.588976, Re/Max At The River  Real Estate  Real Estate Agent  building apartment business   Services 
361738,34.573702,-114.372579, Cinema Aircraft Restoration  Airport    aircraft maintenance   Transportation 
361749,35.207521,-114.034439, Frontier  Professional  Management & Consulting  consultant telecommunication   Services 
361810,35.107989,-114.620992, Economic Security Dept  Government  Office  state resource   Public Place 
361821,35.189564,-114.058685, Canada Mart  Autos & Motor Vehicles  Fuel & Gas Station  food gasoline gift   Retail Goods 
361837,34.197507,-114.221634, LA Paz Insurance Agcy  Insurance  Insurance Agent  loan real estate   Services 
361844,35.195418,-114.033102, Allstate Insurance  Insurance  Insurance Agent  training sales   Services 
361880,35.108001,-114.61642, M Charles Productions  Professional    establishment   Services 
361885,35.097051,-114.630478, Clearwater Storage  Freight    commercial storage   Transportation 
361901,32.723583,-114.648886, Acme Refrigeration & Heating  Building & Trades  Plumbing  contractor   Services 
361907,35.224013,-114.256083, Morning Glory  Shopping  Gifts & Souvenirs  contractor   Retail Goods 
361913,34.504357,-114.347967, Advantage Boats Inc  Manufacturing  Watercraft  product mfg   Manufacturing & Wholesale Goods 
361928,32.631927,-114.572924, Butler Electronics  Shopping  Computers & Home Electronics  painter   Retail Goods 
361933,35.111347,-114.577759, Don's Mobile Locksmithing  Retail  Repair Shop  lock locksmith   Services 
361935,35.209189,-114.023854, Mandley's  Professional  Computer Services  repair   Services 
361937,34.491791,-114.347976, Eb Marketing Group  Manufacturing  Tools & Machinery  ceiling sales   Manufacturing & Wholesale Goods 
361959,35.097521,-114.619107, Angel's Touch Care Home  Social Services  Adult Care  home   Services 
361962,35.203284,-114.236594, J & A Concrete  Building & Trades  Construction  concrete contractor   Services 
361985,32.631124,-114.573646, Litton Integrtd Data Systems  Government  Office  national security   Public Place 
361998,32.66114,-114.475416, Fred S Contracting Servic  Building & Trades  Construction  building apartment   Services 
362025,34.202749,-114.223271, Adkins & Cowell Inc  Professional    pharmaceutical product   Services 
362058,34.520628,-114.340092, Mikes Mobile Home Service  Building & Trades  Construction  house   Services 
362060,34.478612,-114.341685, Walgreens Health Initiatives  Wholesale  Medical Equipment & Supplies  house   Manufacturing & Wholesale Goods 
362109,34.995931,-114.583841, Fairway Constructors Inc  Building & Trades  Construction  contractor   Services 
362148,35.107334,-114.624737, Cheaper House Keepers  Building & Trades  Cleaning & Sanitation  house   Services 
362155,35.100637,-114.603577, Graffiti Eradication  Building & Trades  Construction  contractor   Services 
362158,35.081624,-114.549072, Brookfield Communities Inc  Real Estate  Real Estate Agent  wrecker   Services 
362173,34.494984,-114.338853, Jokers Wild Promotions  Recreation  Marina  operation   Entertainment 
362174,35.082829,-114.597139, Payless Shoe Source  Shopping  Shoes  operation   Retail Goods 
362210,32.703647,-114.624733, Zacatecano Restaurant  Restaurant    eating   Food & Drink 
362226,34.158187,-114.297048, Triple DJ Homes  Home & Garden  Mobile Homes  water house restoration damage   Retail Goods 
362241,34.476054,-114.33, Printing Plus  Manufacturing  Printing  lithographic commercial advertising   Manufacturing & Wholesale Goods 
362259,34.478972,-114.334534, Huffman Chiropractic Office  Health Services  Chiropractor  counselor   Services 
362302,32.720346,-114.6418, J D Gardening  Building & Trades  Landscaping Services  canned f frozen juice bottled food   Services 
362314,32.705771,-114.623333, Refrigeration Supplies Distr  Wholesale  Hardware  refrigeration   Manufacturing & Wholesale Goods 
362325,34.489949,-114.294245, A To Z Equipment Repair  Retail  Repair Shop  equipment   Services 
362342,32.684347,-114.624561, El Desierto  Professional    telephone cellular   Services 
362381,32.696793,-114.620239, Kaman Industrial Tech Corp  Wholesale  Machinery & Supplies  bearing   Manufacturing & Wholesale Goods 
362385,32.680223,-114.624577, Sugars Cocktails  Bars & Pubs    drinking   Food & Drink 
362386,35.010805,-114.598062, Rio Micro  Professional  Computer Services  repair   Services 
362442,34.482582,-114.350626, Walts Kawasaki-Yamaha Plus  Autos & Motor Vehicles  Boat Sales  ski motorcycle jet   Retail Goods 
