401464,34.907875,-114.597886, Big River Fence & Supply Co  Wholesale  Construction Materials  fence   Manufacturing & Wholesale Goods 
401479,34.474188,-114.344198, Bass Shoe Factory Outlet 266  Shopping  Shoes  village   Retail Goods 
401483,33.67402,-114.208454, Quartzsite Public Library  Education  Library  reservation housing corporates   Public Place 
401493,35.075354,-114.592549, Si Motors  Autos & Motor Vehicles  Automobile Sales  used   Retail Goods 
401524,34.465808,-114.33008, Red Hot Desert Builders  Building & Trades  Construction  house   Services 
401527,35.208103,-114.034508, Stat Medical Supplies Inc  Building & Trades  Equipment Rental  medical durable rent   Services 
401532,35.187928,-114.038023, Mad Dog's Bar & Grill  Restaurant    automobile stereo radio   Food & Drink 
401533,34.458701,-114.29869, Mr Ray Farrow  Manufacturing  Wood Products  mfg   Manufacturing & Wholesale Goods 
401551,32.677592,-114.650381, Yuma Tire  Autos & Motor Vehicles  Auto Supplies  tire   Retail Goods 
401561,32.67618,-114.632317, Scrapbook Maniac  Manufacturing  Printing  mfg   Manufacturing & Wholesale Goods 
401577,34.148731,-114.289759, LA Paz County Health Dept  Government  Office  county program health   Public Place 
401585,34.502987,-114.350993, Kim Jackson Accounting & Taxes  Professional  Accounting & Tax Preparation  accountant   Services 
401590,34.461787,-114.328624, Jeff's Masonry Inc  Building & Trades  Construction  masonry contractor   Services 
401602,32.691791,-114.6312, Ho Made Industries  Manufacturing  Retail Goods  product mfg   Manufacturing & Wholesale Goods 
401613,35.149539,-114.568121, Circle K  Food & Beverages  Groceries & Convenience Stores  interior consultant design decorator   Retail Goods 
401665,32.611275,-114.639565, Vidales Auto Sales  Autos & Motor Vehicles  Automobile Sales  used   Retail Goods 
401671,34.200409,-114.220409, Keys Pizza  Restaurant    eating   Food & Drink 
401681,32.677382,-114.58178, Air Cndtning Htg By Airtronics  Building & Trades  Plumbing  sales heating installation conditioning air   Services 
401684,34.496097,-114.354204, Edwards AC & Refrig  Professional    establishment   Services 
401709,35.25403,-114.016545, Fred's Plastering  Building & Trades  Construction  plastering contractor   Services 
401716,34.476326,-114.331018, Lily's Mode A Day  Shopping  Clothing  Apparel  & Fashions  lock   Retail Goods 
401720,35.195598,-114.033687, Farm Bureau Insurance  Insurance  Insurance Agent  advertising specialty sportswear imprinted   Services 
401730,35.229442,-114.04456, Gold Doctor  Shopping  Jewelry  jeweler   Retail Goods 
401755,35.010805,-114.598062, Mohave Radiator  Wholesale  Auto Parts  repairing automotive radiator automobile   Manufacturing & Wholesale Goods 
401771,33.66694,-114.226155, First Baptist Church  Organizations  Religious Organization  church   Services 
401775,32.709532,-114.624588, Ed Whiteheads Tire  Wholesale  Auto Parts  automotive supply general   Manufacturing & Wholesale Goods 
401807,35.113113,-114.609562, Scott Plumbing  Building & Trades  Plumbing  plumbing contractor   Services 
401868,32.684209,-114.606901, Charlies Construction LLC  Building & Trades  Construction  house   Services 
401873,35.084633,-114.597889, Riviera Paint & Hardware Ctr  Home & Garden  Building Materials  paint   Retail Goods 
401918,35.127219,-114.5766, All In One Realty  Real Estate  Real Estate Agent  grocer   Services 
401930,35.203196,-114.029269, Lampstand Lights  Shopping    merchandise   Retail Goods 
401982,34.457229,-114.284299, LA Palms  Home & Garden  Garden Supply  nurseryman   Retail Goods 
402034,35.049339,-114.588967, Mohave Floors  Building & Trades  Construction  resurfacing laying refinishing floor   Services 
402055,34.481831,-114.326938, Galati Development Inc  Real Estate  Real Estate Agent  religious   Services 
402079,32.698525,-114.652657, Hancock Fabrics  Shopping  Crafts & Fabrics  store   Retail Goods 
402080,34.478487,-114.33262, Hanger Prosthetics & Orthotics  Manufacturing  Tools & Machinery  limb artificial braces mfg   Manufacturing & Wholesale Goods 
402092,35.191038,-114.067246, Housing & Community Dev  Government  Office  county planning dev   Public Place 
402124,35.25473,-114.035935, Robin R Mosby CPA  Professional  Accounting & Tax Preparation  accountant   Services 
402144,34.475807,-114.329264, Havasu Bead Studio  Wholesale  Jewelry  beads   Manufacturing & Wholesale Goods 
402151,34.473422,-114.292469, Big TS  Building & Trades  Landscaping Services  tree trimming   Services 
402164,35.268763,-114.26912, 20th Century Realty  Real Estate  Real Estate Agent  rental vacation   Services 
402169,34.940431,-114.573702, Larry's Stop Shop  Retail  Auto Repair  brake   Services 
402187,32.67164,-114.452824, Yuma Landscaping  Building & Trades  Landscaping Services  landscape   Services 
402209,35.116706,-114.599067, Bank One  Banks & Credit Unions  Bank  national commercial   Services 
402217,34.478727,-114.350569, 3 Boyz Custom Floor Covering  Home & Garden  Carpets & Floor Coverings  dealer rug   Retail Goods 
402231,35.211989,-114.015606, Little Brown Jug Liquor Store  Food & Beverages  Liquor & Beverages  tire   Retail Goods 
402252,34.476834,-114.343555, Mesquite Car Wash & Mobil  Autos & Motor Vehicles  Fuel & Gas Station  oil   Retail Goods 
402256,34.154908,-114.290261, Drum's Plating  Manufacturing  Metals  plating   Manufacturing & Wholesale Goods 
402260,34.496233,-114.339912, Finney's  Manufacturing  Rubber & Plastics  house   Manufacturing & Wholesale Goods 
402265,35.153131,-114.56753, Erickson Realty Inc  Real Estate  Real Estate Agent  trucking   Services 
402269,34.475612,-114.328853, All-Tech  Shopping  Computers & Home Electronics  equipment dealer   Retail Goods 
402273,34.477077,-114.33916, Havasu Water Co  Utilities  Water  company sewage   Services 
402300,34.476729,-114.332479, Regan's Catering  Restaurant    caterer   Food & Drink 
402303,35.20596,-114.034135, Fastrax Urgent Care Ctr  Health Services  Hospital  publishing   Services 
402311,34.492559,-114.31104, American Pools & Spa  Building & Trades  Construction  designer dealer pool swimming   Services 
402313,34.496053,-114.344347, Alternator Specialties Auto  Autos & Motor Vehicles  Auto Supplies  alternator generator   Retail Goods 
402339,35.108837,-114.598021, Our Town Magazine  Manufacturing  Printing  news counselor periodical   Manufacturing & Wholesale Goods 
402439,34.907875,-114.597886, Mustang Communications  Shopping  Computers & Home Electronics  investor   Retail Goods 
402447,34.470266,-114.298004, Nationwide Construction Co Inc  Building & Trades  Construction  contractor   Services 
402474,35.288205,-114.045788, Fountain Real Estate and Dev  Real Estate  Real Estate Agent  manicuring   Services 
402479,32.675219,-114.436025, Western Development Ventures I  Real Estate  Developer  merchandise   Services 
402525,35.193373,-114.024769, Kingman Academy Of Learning  Education  School  eating   Public Place 
402529,34.474968,-114.32365, Canmed  Shopping  Pharmacy  personal financing institution   Retail Goods 
402539,34.494076,-114.309421, Shaklee Athorized Distr Traing  Food & Beverages  Specialty  trophy medal award   Retail Goods 
402541,34.478073,-114.319124, Community Development Dept  Professional  Management & Consulting  executive business   Services 
402545,35.069744,-114.592819, Palo Verde Meadows Property  Building & Trades  Landscaping Services  landscape contractor   Services 
402550,34.469338,-114.270408, Hertzens Quality Vende Service  Wholesale  Vending Machines  operator   Manufacturing & Wholesale Goods 
402574,35.156335,-114.283185, C & C Computer Svc  Professional  Computer Services  repair   Services 
402600,35.208942,-114.018285, Mountain Vista Ranches  Farming  Livestock Farm  ranch   Manufacturing & Wholesale Goods 
402604,34.150622,-114.28752, Unemployment Insurance  Government  Office  state resource   Public Place 
402614,35.096451,-114.630477, Chp Manage Ment Group  Real Estate  Real Estate Operator  building apartment   Services 
402647,34.474028,-114.346718, Piccadilly Circus  Shopping  Gifts & Souvenirs  photographer   Retail Goods 
402700,35.205858,-114.031244, B3 Engineering Inc  Building & Trades  Construction  concrete contractor   Services 
402720,35.204662,-114.033303, George David H  Health Services  Optometrist  optometry clinic   Services 
402733,34.481941,-114.347802, Dave Eaton  Real Estate  Real Estate Agent  attorney   Services 
402816,34.461904,-114.256225, Roy Wheeler  Real Estate  Real Estate Agent  home   Services 
402828,34.499027,-114.361358, Lake Havasu Street Mntnc  Government  Office  village   Public Place 
402848,35.122858,-114.582248, River Front Resort Motel  Travel  Hotels & Motels  training sales   Entertainment 
402870,32.681703,-114.442825, Merkel Property Dev LLC  Real Estate  Real Estate Operator  building nonresidential   Services 
402912,35.092077,-114.598048, Lawyers Title  Insurance  Title Insurance  church   Services 
402936,35.99927,-114.081633, Ken's Automotive & Mrne Repair  Retail  Auto Repair  repairing automobile   Services 
402954,34.507209,-114.346939, Image Auto Body & Paint  Wholesale  Motor Vehicles  automobile truck broker   Manufacturing & Wholesale Goods 
402979,34.479551,-114.341988, Hilltop Homes & Development  Building & Trades  Construction  home general for contractor   Services 
402986,34.476771,-114.340475, Goldberg & Osborne  Professional  Lawyer & Legal Services  attorney   Services 
403077,32.698598,-114.623964, Fritzys  Professional    mfg cut footwear stock   Services 
403087,35.109943,-114.555125, Clearwater Medical  Health Services  Doctor  physician surgeon   Services 
403094,32.669442,-114.622664, Carrows 192  Restaurant    eating   Food & Drink 
403103,35.084633,-114.597889, Flawless Window Tinting  Retail  Auto Repair  glass coating tinting automotive   Services 
403152,33.781614,-113.617819, Mo's Fix-It  Home & Garden  Hardware  laboratory   Retail Goods 
403170,32.670011,-114.552042, R V Connections  Autos & Motor Vehicles  Recreational Vehicle Sales  hospice   Retail Goods 
403189,32.657542,-114.444041, Courtyard Apparel  Shopping  Clothing  Apparel  & Fashions  accessory   Retail Goods 
403210,32.711719,-114.645487, A & I Builders LLC  Building & Trades  Construction  house   Services 
403216,35.190009,-114.058498, Carpets By Clint  Professional    establishment   Services 
403226,34.491769,-114.351628, Samons Bros Framing Inc  Building & Trades  Construction  mfg contractor member wood structural carpentry   Services 
403241,35.119789,-114.59251, Country Ranch G M A C RE  Real Estate  Real Estate Agent  church   Services 
403244,34.498137,-114.285732, Bridgewater Homes Inc  Building & Trades  Construction  general contractor   Services 
403249,34.478682,-114.33322, Line Care Headquarters  Health Services  Clinic  equipment therapy oxygen   Services 
403257,33.683487,-114.231796, KBUX  Communications  Radio Station  company broadcasting   Services 
403264,35.111429,-114.562961, Family Dentistry  Health Services  Doctor  dentist   Services 
403282,35.174797,-113.986598, Four Corners Pipeline Co  Wholesale  Petroleum  pipe line company   Manufacturing & Wholesale Goods 
403290,35.218821,-114.147421, Golden Valley Collision Ctr  Retail  Auto Repair  body automobile painting   Services 
403298,34.474933,-114.326245, River Exchange  Shopping  Used Merchandise  store   Retail Goods 
403364,34.542867,-114.366303, Lake Havasu Rv Park  Travel  Campground  landscape   Entertainment 
403369,34.461082,-114.308448, Jewett Acoustics  Building & Trades  Construction  contractor   Services 
403374,34.993362,-114.598054, Wigwam Ceramics  Shopping  Gifts & Souvenirs  plumbing contractor   Retail Goods 
403385,32.706854,-114.657321, Scrubs Unlimited  Shopping  Clothing  Apparel  & Fashions  painter sign   Retail Goods 
403439,34.486653,-114.275448, Axis Roofing  Building & Trades  Construction  roofing contractor   Services 
403488,35.188671,-114.052992, Shirt Shop & Custom Signs The  Shopping  Clothing  Apparel  & Fashions  shirt t   Retail Goods 
403498,35.213907,-114.038816, Rx Juice  Restaurant    eating   Food & Drink 
403500,35.089961,-114.598035, Get Framed  Shopping    picture frame   Retail Goods 
403501,34.475888,-114.33041, Health Care Cost System  Government  Office  state program health   Public Place 
403517,32.667777,-114.409841, Karen Spencer Realtor Ltd  Real Estate  Real Estate Agent  masonry contractor   Services 
403518,35.026874,-114.597976, Romay Chiropractic  Health Services  Chiropractor  masonry contractor   Services 
403609,34.492103,-114.347978, Spencers Carpet Outlet Inc  Home & Garden  Carpets & Floor Coverings  eating   Retail Goods 
403633,35.075037,-114.592387, Our Kids Place  Social Services  Child Care  house   Services 
403680,35.218531,-114.031822, Whataburger  Restaurant    fast   Food & Drink 
403684,35.200621,-114.020264, Young Electric Sign Co  Manufacturing  Signs  specialty mfg   Manufacturing & Wholesale Goods 
403702,34.497889,-114.356931, Arizona Republic  Manufacturing  Printing  newspaper   Manufacturing & Wholesale Goods 
403730,35.26287,-113.944423, B & R Fabrication  Manufacturing  Metals  pipe fabricated mfg   Manufacturing & Wholesale Goods 
403756,34.476711,-114.332138, Ideas Media Consulting  Manufacturing  Printing  multimedia   Manufacturing & Wholesale Goods 
403785,32.669513,-114.6146, Hearing Aid Specialist  Shopping    aids hearing   Retail Goods 
403796,32.650298,-114.584323, Kim Stern  Professional    advisory investment   Services 
403837,35.254044,-114.032404, Bicycle World  Shopping  Bicycles & Sporting Goods  merchandise   Retail Goods 
403844,34.200335,-114.220271, Circle K  Food & Beverages  Groceries & Convenience Stores  pathologist speech   Retail Goods 
403851,34.505697,-114.347905, Samons Billiards  Wholesale  Sporting Goods  equipment billiard supply   Manufacturing & Wholesale Goods 
403869,32.698397,-114.649501, Shay Oil Company Inc  Autos & Motor Vehicles  Fuel & Gas Station  station gasoline   Retail Goods 
403896,35.201564,-114.029193, Forsyth & Johannsen  Health Services  Chiropractor  product   Services 
403970,34.503089,-114.349151, Pet Clips  Retail  Animal Services  pet grooming washing   Services 
404033,34.990983,-114.580538, Angel's Touch  Social Services  Adult Care  home residential   Services 
404053,34.486022,-114.308436, Celebrities  Food & Beverages  Specialty  opportunity   Retail Goods 
404063,32.652281,-114.563888, Ironwood Equestrian Center  Retail  Animal Services  eating   Services 
404073,35.268423,-114.030933, MCC Head Start  Social Services  Child Care  kindergarten academic school   Services 
404098,35.112407,-114.598119, Carpenters  Organizations  Labor Organization  metal   Services 
404138,35.082829,-114.597139, Cingular Wireless  Shopping    cellular telephone merchandise   Retail Goods 
404144,34.501279,-114.348026, Globemasters Travel Network  Professional  Business Services  operator tour   Services 
404153,35.035262,-114.59599, KVGS  Communications  Radio Station  company broadcasting   Services 
404155,35.191713,-114.053183, Honorable Robert Moon  Government  Office  general contractor   Public Place 
404164,35.208942,-114.018285, Nationa Credit Repair  Personal    credit debt counseling   Services 
404192,32.707616,-114.634372, Dennis Dirty Deeds  Building & Trades  Landscaping Services  automobile lubrication   Services 
404195,34.47745,-114.336435, Lucky Girl  Shopping  Clothing  Apparel  & Fashions  general contractor   Retail Goods 
404208,32.68106,-114.50793, Cross Stitch Delight  Shopping  Crafts & Fabrics  sewing   Retail Goods 
404274,35.109125,-114.618229, Dancers Workshop  Education  Dance Studio  instruction dancing   Public Place 
404278,34.146675,-114.288491, American Family Insurance  Insurance  Insurance Agent  communication radio except   Services 
404279,34.858662,-114.604196, Hartwick's Mane Headquarters  Personal  Beauty Salon  communication radio except   Services 
404327,34.494743,-114.335036, Benny's Road Svc  Retail  Auto Repair  repairing tire   Services 
404351,35.19062,-114.063585, Mahaue Country Department  Professional    eating   Services 
404374,32.698714,-114.590274, Wild West Motor Sports  Autos & Motor Vehicles  Recreational Vehicle Sales  stone   Retail Goods 
404387,35.119789,-114.59251, East Shore Villas-Bullhead  Professional    establishment   Services 
404396,32.698597,-114.585871, Annas Mexican Food  Food & Beverages  Groceries & Convenience Stores  lock locksmith   Retail Goods 
404405,34.496236,-114.341096, Blitz Electric  Building & Trades  Electrical  electric contractor   Services 
404421,34.151331,-114.289663, Lomax Drywall  Building & Trades  Construction  contractor   Services 
404430,35.246683,-114.011533, Canyon Community Church  Organizations  Religious Organization  church   Services 
404444,34.476812,-114.323853, Taco Hacienda  Restaurant    eating   Food & Drink 
404460,34.476042,-114.280994, Cold Stone Creamery  Manufacturing  Food  creamery butter mfg   Manufacturing & Wholesale Goods 
404495,32.712434,-114.667536, Jesses Restaurant  Restaurant    eating   Food & Drink 
404579,32.680041,-114.611078, Williams Computer Services  Shopping  Computers & Home Electronics  motion picture studio producer   Retail Goods 
404590,34.144391,-114.28555, Colorodo River Indian Tr  Government  Office  council dept tribal game fish   Public Place 
404663,35.222226,-114.010623, J & J Customs  Professional    establishment   Services 
404781,34.497793,-114.345143, Pitzer Airconditioner  Retail  Repair Shop  equipment conditioning air   Services 
404786,34.872808,-114.626914, Mariah Arabians  Freight    operator local trucking   Transportation 
404788,32.715897,-114.617113, Dos Rios  Wholesale  Fruits & Vegetables  operator local trucking   Manufacturing & Wholesale Goods 
404811,32.681976,-114.507131, Kellys Ice Cream  Restaurant    operator eating local trucking   Food & Drink 
404829,34.989561,-114.597968, Serranos Nursery & Landscapin  Home & Garden  Garden Supply  stone   Retail Goods 
404859,32.67127,-114.624475, Yuma Christian Books & Gifts  Shopping  Books  instrument musical   Retail Goods 
404868,34.065542,-114.390189, CRIT Head Start Program  Education  School  depository banking check cashing   Public Place 
404877,34.150833,-114.290961, House2house Cleaning Supply Co  Shopping    merchandise   Retail Goods 
404901,32.676948,-114.616289, International Design LLC  Shopping  Gifts & Souvenirs  polishing washing   Retail Goods 
404909,35.074402,-114.591976, Gordy's Auto Body & Frame  Retail  Auto Repair  body automobile painting   Services 
404919,32.5674,-114.661359, Nickers-Horses Only  Retail  Animal Services  specialty   Services 
404928,34.486946,-114.307117, Coreys Landscaping  Building & Trades  Landscaping Services  landscape   Services 
404939,35.218615,-114.032407, Domino's Pizza  Restaurant    pizza   Food & Drink 
404949,32.693952,-114.615191, Yuma Carpets  Home & Garden  Carpets & Floor Coverings  counselor marriage family   Retail Goods 
405012,34.507667,-114.344378, Mohave County Public Defender  Government  Court House  county counsel   Public Place 
405028,35.208199,-114.034517, Jonathan Roberts Financial Grp  Banks & Credit Unions  Investment Brokerage  consultant planning financial   Services 
405069,35.20236,-113.96581, Hkm Builders  Building & Trades  Construction  house   Services 
405082,35.194011,-113.990084, Carmine Randazzo  Shopping  Bicycles & Sporting Goods  publishing   Retail Goods 
405088,34.894825,-114.564913, Michael Brugger Construction  Building & Trades  Construction  general contractor   Services 
405147,34.473146,-114.278118, Hardbacker  Manufacturing  Printing  bookbinder   Manufacturing & Wholesale Goods 
405150,35.212678,-114.017624, G V Lawson  Building & Trades  Construction  general contractor   Services 
405155,34.506926,-114.347911, A Yard Shop  Building & Trades  Landscaping Services  lawn maintenance grounds   Services 
405166,34.475851,-114.342062, Paulines Fashionwear & Shoes  Shopping  Clothing  Apparel  & Fashions  wear shoes   Retail Goods 
405195,32.678626,-114.624509, Lorenzo Fine Jewelry  Shopping  Jewelry  plumbing contractor   Retail Goods 
405252,33.660941,-114.199723, Cloud's Trailer Park  Real Estate  Developer  mobile home   Services 
405325,35.152502,-114.568672, River Queen Resort Motel  Travel  Hotels & Motels  repairing automobile   Entertainment 
405342,32.682992,-114.633242, Yrmc Gift Shop  Shopping  Gifts & Souvenirs  computer electronic mfg   Retail Goods 
405345,32.713142,-114.63732, Valley Pre Paid Phone Cards  Retail  Repair Shop  mfg reupholstery upholstery furniture mattress   Services 
405348,32.703126,-114.679225, Culp Used Pianos  Retail  Repair Shop  instrument musical   Services 
405354,34.515466,-114.34733, Hawk-Eye Lath & Plastering Inc  Building & Trades  Construction  plastering lath contractor   Services 
405356,34.496097,-114.354204, Consolidated Mechanical  Building & Trades  Plumbing  food equipment processing contractor   Services 
405357,35.122858,-114.582248, J D Engine Repair  Retail  Auto Repair  repairing engine   Services 
405382,35.190193,-114.058808, Pawn World  Shopping  Used Merchandise  sweeping parking lot contractor   Retail Goods 
405410,35.10059,-114.596578, Silly Cactus TS & More  Shopping  Clothing  Apparel  & Fashions  t   Retail Goods 
405434,32.689328,-114.607579, Thats Cool Inc  Manufacturing  Rubber & Plastics  footwear mfg   Manufacturing & Wholesale Goods 
405435,34.473668,-114.325839, Arizona Boat Movers  Freight    footwear mfg   Transportation 
405445,32.710543,-114.663221, P & S Sales and Salvage  Professional  Business Services  refuse system con   Services 
405483,33.666409,-114.206263, Beall's Outlet  Shopping  Department Store  apartment   Retail Goods 
405503,35.107651,-114.547178, Longridge Mobile Home Park  Real Estate  Real Estate Operator  mobile home site   Services 
405522,34.47734,-114.337295, Accounts Payable  Government  Office  village   Public Place 
405567,34.493656,-114.35267, Frontier Concrete  Building & Trades  Construction  concrete contractor   Services 
405588,34.496172,-114.35431, Hilltop Homes & Development  Building & Trades  Construction  general contractor   Services 
405642,35.097809,-114.616938, Colorado River Exterior  Building & Trades  Landscaping Services  pet grooming washing merchandise   Services 
405681,35.10059,-114.596578, Rent-A-Center  Building & Trades  Equipment Rental  yard   Services 
405705,34.993362,-114.598054, Bee's Used Books & Things  Shopping  Used Merchandise  book rare dealer   Retail Goods 
405708,32.691764,-114.615927, Hughes-Calihan Corporation  Shopping    merchandise   Retail Goods 
405709,34.52142,-114.345456, Desert Wide Builders LLC  Building & Trades  Construction  house   Services 
405711,32.708378,-114.618434, Estes Insulation Inc  Building & Trades  Construction  contractor   Services 
405745,34.477668,-114.335417, Bank One  Banks & Credit Unions  Bank  national commercial   Services 
405783,34.496097,-114.354204, Howard Fabricating  Retail  Auto Repair  body automobile top upholstery   Services 
405795,34.478447,-114.341586, Tire and Auto Service Center  Retail  Auto Repair  center tire   Services 
405812,32.65748,-114.650152, Dandy Cooling Yuma LLC  Farming  Farm & Veterinary Services  crop   Manufacturing & Wholesale Goods 
405814,32.708315,-114.624588, T V Johnnys & Electronics  Shopping  Computers & Home Electronics  building nonresidential   Retail Goods 
405841,34.151177,-114.289753, E Z Net One  Professional  Computer Services  communications internet   Services 
405857,35.120421,-114.589729, Secondhand Rose New & Used  Home & Garden  Furniture  specialty mfg   Retail Goods 
405879,35.210393,-114.052948, Housing Aid of Arizona Inc  Real Estate  Real Estate Operator  project rural housing rental   Services 
405883,35.122057,-114.582253, Grand Vista Hotel Inc  Travel  Hotels & Motels  mechanical contractor   Entertainment 
405891,35.108003,-114.618455, Citizens Utilities Co  Utilities  Telephone  company   Services 
405895,32.700907,-114.624582, Dial A Ride  Taxi    taxicab   Transportation 
405904,34.148121,-114.290949, Chief Auto Parts  Wholesale  Auto Parts  marketing representative consultant   Manufacturing & Wholesale Goods 
405919,32.719438,-114.638093, Chretins Mexican Foods  Restaurant    beer serving liquor wine   Food & Drink 
406020,34.477244,-114.339534, Marshall Hair Co  Personal  Beauty Salon  church   Services 
406028,35.10059,-114.596578, Albertsons  Food & Beverages  Groceries & Convenience Stores  grocer   Retail Goods 
406047,34.478682,-114.33322, French Bouquet Florist  Shopping    plant flower tree artificial   Retail Goods 
406050,34.478843,-114.33384, Viking Lighting Inc  Wholesale  Electrical  fixture ceiling lighting fan   Manufacturing & Wholesale Goods 
406051,34.152965,-114.297052, Mague's Styling Crew  Personal  Beauty Salon  fixture ceiling lighting fan   Services 
406123,34.476446,-114.331756, Havasu Medical Supply  Wholesale  Chemicals & Plastics  oxygen   Manufacturing & Wholesale Goods 
406256,35.09922,-114.625642, D & J Mobile Repair Service  Building & Trades  Plumbing  mobile home contractor   Services 
406349,35.076223,-114.593262, Palo Verde Physical Therapy  Health Services  Health Practitioner  therapist physical   Services 
406358,32.684076,-114.611352, Sophias Dog House  Retail  Animal Services  communication counselor mfg   Services 
406370,34.145322,-114.292226, J & S Electric  Building & Trades  Electrical  electrical electric contractor   Services 
406391,34.454205,-114.297525, Pro Detail  Retail  Car Wash  automobile detail clean   Services 
406395,35.222436,-114.220451, Golden Paradise Land Owners  Real Estate  Developer  company land   Services 
