1544046,38.085049,-102.617638, City of Lamar  Government  Office  municipality   Public Place 
1544074,38.821157,-102.355435, Berg & Berg  Professional    establishment   Services 
1544080,40.638005,-102.262794, Knight & Son Home Decorating  Home & Garden  Carpets & Floor Coverings  dealer rug   Retail Goods 
1544141,40.157949,-102.246323, Bledsoe Cattle Co  Farming  Livestock Farm  feeding   Manufacturing & Wholesale Goods 
1544189,38.077888,-102.618254, St Francis Credit Union  Banks & Credit Unions  Bank  state   Services 
1544371,40.069762,-102.241337, TAC  Shopping  Computers & Home Electronics  designer landscape   Retail Goods 
1544476,38.342476,-102.214924, SBT Production  Farming  Farm & Veterinary Services  breeder livestock   Manufacturing & Wholesale Goods 
1544532,39.584737,-102.533907, Harbour Tax & Accounting  Professional  Accounting & Tax Preparation  return filing   Services 
1544581,39.305631,-102.605042, Gambles  Home & Garden  Carpets & Floor Coverings  dealer rug   Retail Goods 
1544675,37.403603,-102.615292, Southeast Mental Health Svc  Social Services    crisis intervention   Services 
1544679,40.071021,-102.239207, Smith Masonry Inc  Building & Trades  Construction  contractor   Services 
1544717,39.29837,-102.278329, Super 8 Motel  Travel  Hotels & Motels  operation   Entertainment 
1544718,37.404188,-102.616597, Brinkley Realty & Associates  Real Estate  Real Estate Agent  operation   Services 
1544758,38.085137,-102.619128, Filbeck Realty  Real Estate  Real Estate Agent  apartment   Services 
1544864,38.085917,-102.620466, TCB Answering Svc  Professional  Business Services  paging answering   Services 
1544962,40.206142,-102.565025, Alliance Farms Coop Assn  Farming  Nursery  ornamental   Manufacturing & Wholesale Goods 
1544975,40.079007,-102.221683, Third Street Auto Repair  Retail  Auto Repair  repairing automobile   Services 
1545065,38.093118,-102.622388, Martinez Excavation  Building & Trades  Construction  excavation contractor   Services 
1545155,38.085309,-102.635291, Inspection Professionals  Real Estate  Real Estate Agent  inspection   Services 
1545252,38.088363,-102.613691, Frank's Auto Svc  Retail  Auto Repair  repairing automobile   Services 
1545312,40.988339,-102.258924, Homestead Tree Farm & Gdn Ctr  Home & Garden  Garden Supply  nurseryman   Retail Goods 
1545383,38.054677,-102.122699, First Bank & Trust  Banks & Credit Unions  Bank  loan   Services 
1545687,38.819839,-102.34805, Wells Theatre  Cinema  Movie Theater  house   Entertainment 
1545699,38.069088,-102.610324, PMC Associated Physicians  Health Services  Doctor  physician surgeon   Services 
1545741,38.053415,-102.12027, Hometown Video  Cinema  Movie Rental  leasing video disc tape   Entertainment 
1545889,39.303108,-102.27886, ALCO  Shopping  Department Store  shop   Retail Goods 
1546024,38.089188,-102.617956, Desiree's  Bars & Pubs    attorney   Food & Drink 
1546200,39.306208,-102.260192, Seelhoff Aerial Spraying Inc  Farming  Farm & Veterinary Services  crop   Manufacturing & Wholesale Goods 
1546235,39.321931,-102.259975, Richards Construction  Building & Trades  Construction  house   Services 
1546399,40.988414,-102.264311, Sedgwick County Assessor  Government  Office  county taxation   Public Place 
1546407,37.659068,-102.267175, David Schnabel Farm  Farming  Livestock Farm  beef feedlot cattle   Manufacturing & Wholesale Goods 
1546591,40.646909,-102.628619, Pierce Sprinkler Service  Wholesale  Machinery & Supplies  interior consultant design decorator   Manufacturing & Wholesale Goods 
1546702,39.388533,-102.520096, Russell Corliss  Building & Trades  Construction  nonresidential   Services 
1546711,38.091318,-102.619568, Kirby Sales & Service  Home & Garden  Household Appliances  cleaners vacuum   Retail Goods 
1546722,40.96203,-102.498428, Rick Lechman  Farming  Farm  crop general   Manufacturing & Wholesale Goods 
1546868,40.579603,-102.300117, Holyoke Swimming Pool  Recreation    executive   Entertainment 
1546954,40.003168,-102.320631, Cornerstone Smr Comm Inc  Professional    establishment   Services 
1547167,40.987596,-102.263331, Thermal Adventures  Building & Trades  Construction  insulation heat contractor   Services 
1547191,39.304179,-102.267957, Michael K Grinnan  Professional  Lawyer & Legal Services  attorney   Services 
1547327,37.388719,-102.279815, Custom Carpentry  Building & Trades  Construction  carpentry contractor   Services 
1547335,40.07591,-102.262778, Bob's & Patti's Used Cars  Autos & Motor Vehicles  Automobile Sales  car dealer   Retail Goods 
1547422,40.641223,-102.628631, Haxtun Herald  Manufacturing  Printing  newspaper   Manufacturing & Wholesale Goods 
1547544,40.078567,-102.222004, Interiors By Vicki  Home & Garden  Furniture  floor covering   Retail Goods 
1547563,39.300835,-102.273199, Carquest Auto Parts  Autos & Motor Vehicles  Auto Supplies  ind mfg   Retail Goods 
1547597,38.07987,-102.618503, Domestic Safety Resource Ctr  Social Services    crisis intervention   Services 
1547719,37.405063,-102.619201, Church Of God  Organizations  Religious Organization  church   Services 
1547721,38.096432,-102.619663, Booze Palace  Food & Beverages  Liquor & Beverages  alcoholic   Retail Goods 
1547923,39.335868,-102.267879, Buff Buddies LLC  Professional    consultant   Services 
1547951,40.176824,-102.566294, Eckley Feed Yard  Farming  Livestock Farm  wheat feedlot cattle   Manufacturing & Wholesale Goods 
1548260,38.087279,-102.619286, Lassie The  Shopping  Clothing  Apparel  & Fashions  software   Retail Goods 
1548307,40.076941,-102.224785, WRAY United Methodist Church  Organizations  Religious Organization  church   Services 
1548413,39.813751,-102.07007, I-76 Speedway  Sports & Exercise  Race Track  automobile parts   Entertainment 
1548421,37.38871,-102.27961, Patti's Place  Restaurant    residential   Food & Drink 
1548670,39.30674,-102.267938, Reta's Sewing Ctr  Retail  Repair Shop  machine sewing   Services 
1548687,37.427311,-102.096134, Todd & Mary Randolph  Farming  Farm  crop   Manufacturing & Wholesale Goods 
1548723,38.080634,-102.613303, Willow Creek Village  Real Estate  Real Estate Operator  mobile home community   Services 
1548804,39.475591,-102.455811, Feeders  Farming  Livestock Farm  feeding   Manufacturing & Wholesale Goods 
1548839,39.295687,-102.278659, Greyhound Bus Lines  Local Transit    bus line   Transportation 
1548873,38.053336,-102.120872, R & T Auto Parts  Autos & Motor Vehicles  Auto Supplies  automobile parts   Retail Goods 
1548964,39.61918,-102.592131, KIRK Equity Co-Op Elevator  Freight    grain elevator   Transportation 
1549029,39.303509,-102.269147, Equitable Savings & Loan Assn  Banks & Credit Unions  Bank  savings loan association   Services 
1549164,40.046754,-102.42753, Godsey Farms Lllp  Farming  Farm  crop general   Manufacturing & Wholesale Goods 
1549270,40.105116,-102.483269, J&B Bar  Bars & Pubs    drinking   Food & Drink 
1549323,39.299604,-102.264174, Hahn Aerial Sprayers  Farming  Farm & Veterinary Services  aerial applicator   Manufacturing & Wholesale Goods 
1549379,39.304618,-102.269343, Colorado Eye Assoc  Health Services  Doctor  physician surgeon   Services 
1549429,38.08907,-102.620683, Gobin's Inc  Shopping  Stationery & Office Supplies  equipment contractor   Retail Goods 
1549544,40.075026,-102.232248, WRAY Housing Authority  Real Estate  Real Estate Agent  authorities housing   Services 
1549574,40.576701,-102.302268, Holyoke Church Of Christ  Organizations  Religious Organization  church   Services 
1549747,38.071665,-102.616411, Hays Farming & Ranching  Farming  Farm  crop general   Manufacturing & Wholesale Goods 
1549761,38.077954,-102.633305, Spady Harvesting  Farming  Farm & Veterinary Services  crop harvesting   Manufacturing & Wholesale Goods 
1549814,37.409028,-102.616615, Wes' Auto Repair  Retail  Auto Repair  repairing automobile   Services 
1549848,40.64147,-102.630369, Haxton Family Center  Health Services  Doctor  medical   Services 
1549902,39.308136,-102.604705, Stratton Auto Recycling  Wholesale  Auto Parts  automobile rebuilt   Manufacturing & Wholesale Goods 
1549991,38.070627,-102.617709, Prowers Cnty Emergency Prepare  Government  Office  department   Public Place 
1550098,39.343709,-102.594673, Grasser Construction Inc  Building & Trades  Construction  product asphalt   Services 
1550203,39.299046,-102.270773, Kit Carson Cnty Sheriffs Dept  Government  Police Station  protection   Public Place 
1550361,40.075444,-102.245132, WRAY Elementary School  Education  School  attorney   Public Place 
1550459,38.821067,-102.346231, Prairie In Bloom  Professional    establishment   Services 
1550465,40.956412,-102.32547, K & K Portable Welding  Building & Trades  Construction  contractor   Services 
1550582,39.307026,-102.267011, Recreation  Recreation    amusement   Entertainment 
1550716,39.302501,-102.280813, Burlington City Shop  Government  Office  agency supply   Public Place 
1551004,38.087078,-102.620487, Tans Plus  Personal  Tanning Parlor  salon   Services 
1551038,40.960788,-102.3879, New Dimensions  Personal  Beauty Salon  building apartment   Services 
1551183,40.070736,-102.230327, WRAY First Baptist Church  Organizations  Religious Organization  church   Services 
1551281,39.305238,-102.26795, Midway Theater  Professional    establishment   Services 
1551286,40.593643,-102.359681, Bornhoft's Body Paint & Glass  Retail  Auto Repair  body automobile painting   Services 
1551473,40.070078,-102.284716, Brueggeman Construction  Building & Trades  Construction  contractor   Services 
1551477,40.693597,-102.531847, B & D Farms  Farming  Farm  treatment skin   Manufacturing & Wholesale Goods 
1551566,38.079288,-102.613473, Hazel Burns  Real Estate  Real Estate Operator  property lessor   Services 
1551852,37.388077,-102.278254, Janet's Beauty & Barber Shop  Personal  Beauty Salon  software   Services 
1551872,40.078517,-102.223497, Bonanza Ford-Mercury Inc  Autos & Motor Vehicles  Automobile Sales  car dealer   Retail Goods 
1551900,40.073039,-102.23096, Ancient Free & Accepted M  Professional    therapist massage   Services 
1551947,38.813432,-102.118536, Rex Waugh  Farming  Livestock Farm  animal general   Manufacturing & Wholesale Goods 
1552103,39.303365,-102.288016, Dynamic Dimensions Inc  Social Services  Job Training  rehabilitation   Services 
1552126,40.994001,-102.269473, Sedgwick County Memorial Hosp  Health Services  Hospital  engineer   Services 
1552152,40.075365,-102.245643, WRAY School District  Education  School  information center diabetes   Public Place 
1552177,38.094364,-102.619737, Stagner Inc  Autos & Motor Vehicles  Automobile Sales  car dealer   Retail Goods 
1552214,40.078859,-102.221503, Kitzmiller-Bales Trust  Professional  Research  foundation philanthropic   Services 
1552274,38.823376,-102.346216, Swimming Pool  Recreation    pool swimming   Entertainment 
1552411,38.085239,-102.613661, Style-N-Polish  Professional    establishment   Services 
1552420,40.075381,-102.225814, Wray Community Child Care Ctr  Social Services  Child Care  day   Services 
1552435,39.304488,-102.601237, Stratton School Dist R-4  Education  School  dist   Public Place 
1552450,40.078839,-102.223788, Slick Spot Lube & Tire Ctr  Autos & Motor Vehicles  Auto Supplies  tire   Retail Goods 
1552471,37.203974,-102.633622, Bryan Lyndell  Professional    malt beverage mfg   Services 
1552539,38.096706,-102.411636, Koehn Land and Cattle  Farming  Livestock Farm  beef feedlot cattle   Manufacturing & Wholesale Goods 
1552551,39.302654,-102.287204, Sunshine Generation  Education  Dance Studio  instruction dancing   Public Place 
1552676,38.082107,-102.610531, Wills Creek Vlg Mission Ctr  Home & Garden  Mobile Homes  operation   Retail Goods 
1552778,39.30562,-102.26942, Burlington Municipal Court  Government  Court House  city   Public Place 
1552871,38.05611,-102.614933, Macarena Club  Organizations  Community Association  club   Services 
1553027,40.078833,-102.220652, Yuma County Co-Op Extension  Government  Office  intercommunication   Public Place 
1553051,38.075945,-102.618039, South Main 66  Retail  Auto Repair  repairing automobile   Services 
1553353,39.392038,-102.538761, Porkchop Ranch  Farming  Livestock Farm  corn wheat feedlot beef cattle   Manufacturing & Wholesale Goods 
1553383,38.379139,-102.196902, Bueller Ron Hired Man 2  Professional    armed force recruiting   Services 
1553531,39.302462,-102.256275, Burlington Chiropractic  Health Services  Chiropractor  investor   Services 
1553609,38.087475,-102.611125, Jag Recycling Inc  Wholesale  Scrap  material   Manufacturing & Wholesale Goods 
1553723,40.30764,-102.160309, Linda Lapp  Farming  Farm  operator general local crop trucking   Manufacturing & Wholesale Goods 
1553754,39.305715,-102.2688, Plains Ground Water Management  Professional  Business Services  water conservation   Services 
1553881,38.088318,-102.615272, Eagle Vision TV  Shopping  Computers & Home Electronics  equipment satellite system   Retail Goods 
1554126,37.391161,-102.616555, A To Z Automotive  Retail  Auto Repair  repairing automobile   Services 
1554180,40.629212,-102.235499, Marty's Yarden  Farming  Nursery  ornamental greenhouse   Manufacturing & Wholesale Goods 
1554189,38.052006,-102.122654, Hair Port  Personal  Beauty Salon  establishment   Services 
1554213,38.124714,-102.118723, T&J Farms LLC  Farming  Farm  crop general   Manufacturing & Wholesale Goods 
1554215,37.405909,-102.615146, Senior Opportunities Program  Social Services    senior citizen   Services 
1554287,38.143143,-102.612886, Bennett Trucking  Freight    operator trucking   Transportation 
1554328,40.586772,-102.26385, Willco Farms  Farming  Farm  cleaners rug carpet   Manufacturing & Wholesale Goods 
1554361,38.08911,-102.620684, C & L Heat and Air  Building & Trades  Plumbing  heating contractor   Services 
1554616,40.645272,-102.633565, Wages Farm Supply  Autos & Motor Vehicles  Auto Supplies  farm equipment parts tire for   Retail Goods 
1554876,40.987153,-102.261401, Fort Sedgwick Museum  Museum    carpentry contractor   Entertainment 
1554895,38.088415,-102.603585, Mirastar 62034  Autos & Motor Vehicles  Fuel & Gas Station  station gasoline   Retail Goods 
1554974,39.658047,-102.480362, Connie Brenner  Farming  Farm  crop general   Manufacturing & Wholesale Goods 
1555107,39.307937,-102.277129, Holm Transfer LLC  Farming  Farm & Veterinary Services  livestock   Manufacturing & Wholesale Goods 
1555246,38.075252,-102.619818, Roth Medical Inc  Health Services  Clinic  equipment therapy oxygen   Services 
1555265,39.302849,-102.270756, Kit Carson County Treasurer  Government  Office  county taxation   Public Place 
1555391,40.071257,-102.235283, Newton Masonry Inc  Building & Trades  Construction  contractor   Services 
1555431,38.079252,-102.613324, Courkamp Enterprises  Building & Trades  Construction  house residential   Services 
1555460,38.087009,-102.620558, Ensignal-Verizon Wireless  Utilities  Mobile Phone  telephone cellular   Services 
1555462,38.088318,-102.615272, Cavanagh Real Estate  Real Estate  Real Estate Agent  repairing automobile   Services 
1555613,40.638673,-102.625515, Grainland Cooperative Frtlzr  Home & Garden  Garden Supply  fertilizer   Retail Goods 
1555615,38.398492,-102.197185, Ron Buller Shop  Professional    establishment   Services 
1555720,39.685907,-102.570462, Wise Dain  Farming  Farm  crop general   Manufacturing & Wholesale Goods 
1555925,38.085204,-102.616288, St Paul's Episcopal Church  Organizations  Religious Organization  church   Services 
1555974,39.308444,-102.269334, Spirit Mtn 12 Step Empori  Shopping  Catalog Store  house mail   Retail Goods 
1556088,38.891077,-102.184136, C & M Farms  Farming  Farm  crop general   Manufacturing & Wholesale Goods 
1556160,38.384547,-102.086635, Floyd Barnes  Farming  Farm  crop general   Manufacturing & Wholesale Goods 
1556183,39.306746,-102.27931, Joe's Garage  Retail  Auto Repair  repairing automobile   Services 
1556354,39.630695,-102.177735, Bureau Of Reclamation  Professional    establishment   Services 
1556562,40.986868,-102.26261, Julian W Hoschouer Jr  Professional  Accounting & Tax Preparation  accountant   Services 
1556606,38.085449,-102.4116, Tempel Grain Elevators LLP  Wholesale  Farm Supplies  bean grain elevator   Manufacturing & Wholesale Goods 
1556765,39.254941,-102.278323, Burlington Aviation  Airport    eating   Transportation 
1556814,39.543529,-102.070488, Cody Farms  Farming  Farm  crop general   Manufacturing & Wholesale Goods 
1556824,39.302755,-102.26812, US Post Office  Government  Post Office  psychic medium   Public Place 
1557120,39.331319,-102.085406, Randy Phillips  Farming  Farm  general contractor   Manufacturing & Wholesale Goods 
1557124,40.322068,-102.19609, 385 Feeders  Professional    establishment   Services 
1557144,40.098513,-102.227521, S & E Industries Wray  Manufacturing  Retail Goods  product mfg   Manufacturing & Wholesale Goods 
1557488,40.584133,-102.296682, T C Transport Inc  Freight    trucking   Transportation 
1557884,40.100616,-102.398534, Marvin J Dickson  Professional    car dealer   Services 
1557922,37.409123,-102.616466, Everitt-Moore Lumber Co  Home & Garden  Building Materials  lumber   Retail Goods 
1557982,39.303541,-102.273226, Revert Farms Inc  Farming  Farm  physician surgeon   Manufacturing & Wholesale Goods 
1558038,37.105216,-102.579232, Campo Cafe  Restaurant    baker   Food & Drink 
1558070,37.40638,-102.617794, Home & Community Based Svcs  Government  Office  program administrative   Public Place 
1558122,39.612331,-102.591959, First National Bank Kirk  Banks & Credit Unions  Bank  state commercial   Services 
1558304,38.077967,-102.618336, Corner Wine & Liquor Shoppe  Food & Beverages  Liquor & Beverages  loan real estate   Retail Goods 
1558402,40.191357,-102.171317, R&L Farms  Farming  Farm  crop general   Manufacturing & Wholesale Goods 
1558568,39.302391,-102.26944, National Health Lab  Professional  Research  laboratory   Services 
1558665,38.088201,-102.619124, Prairie Sky Art Studio/Gallery  Education  Special Training  school instruction art   Public Place 
1558785,39.306074,-102.261367, Shanghai City  Restaurant    eating   Food & Drink 
1558792,38.080814,-102.63154, Ken's General Svc  Building & Trades  Landscaping Services  lawn maintenance grounds   Services 
1558810,38.088531,-102.612289, Eagle Visions  Building & Trades  Electrical  cable   Services 
1558910,38.090391,-102.6195, Passport Inn  Travel  Hotels & Motels  electrical contractor   Entertainment 
1558962,39.300826,-102.287263, Church Of Christ  Organizations  Religious Organization  church   Services 
1559046,38.084795,-102.625412, Washington Elementary School  Education  School  engineer   Public Place 
1559178,39.296045,-102.278663, Burlington Liquor  Food & Beverages  Liquor & Beverages  alcoholic   Retail Goods 
1559324,38.085901,-102.606773, Plains Trophy Shop  Shopping    trophy shop   Retail Goods 
1559329,39.306096,-102.604958, Triple L Ice House & Beverage  Food & Beverages  Liquor & Beverages  alcoholic   Retail Goods 
1559348,40.079787,-102.222018, Chuck's Service-U-Haul  Retail  Auto Rental  renting truck leasing   Services 
1559377,37.401103,-102.616448, Baca County Library  Education  Library  eating   Public Place 
1559517,40.075928,-102.265717, WRAY Feed Co Inc  Wholesale  Farm Supplies  grain   Manufacturing & Wholesale Goods 
1559570,37.104506,-102.576779, Campo School District  Education  School  leasing snowmobile   Public Place 
1559589,40.644784,-102.634602, XCEL Comm Tech Inc  Professional    crop general   Services 
1559599,40.066238,-102.226732, Colorado Pure Pack Inc  Professional    establishment   Services 
1559612,38.058209,-102.616682, US Resource Conservation  Government  Office  equipment dealer software   Public Place 
1559705,38.813966,-102.374817, National-Oilwell Varco  Wholesale  Machinery & Supplies  equipment oil well   Manufacturing & Wholesale Goods 
1559711,39.306663,-102.269253, Counseling Services-Burlington  Social Services    counseling   Services 
1559777,40.527375,-102.100454, Dog Training By Diane  Retail  Animal Services  training dog   Services 
1560007,40.116755,-102.227203, Gary Earl  Farming  Livestock Farm  beef feedlot cattle   Manufacturing & Wholesale Goods 
1560014,40.078989,-102.22383, B & L Liquor  Food & Beverages  Liquor & Beverages  alcoholic   Retail Goods 
1560064,40.352296,-102.137251, Lenz Farms  Farming  Livestock Farm  corn beef cattle   Manufacturing & Wholesale Goods 
1560167,37.404199,-102.613845, David Cope  Real Estate  Real Estate Operator  farm property grain cash lessor   Services 
1560217,40.988132,-102.264139, Northeast Colorado Health Dept  Government  Office  administrative program health   Public Place 
1560345,38.088267,-102.619359, Lamar Area Hospice Assn  Health Services  Nursing And Care Facility  hospice   Services 
1560361,38.088283,-102.615302, Ark Valley Optometry  Health Services  Optometrist  manicuring   Services 
1560580,38.052081,-102.122146, Country Charm Hair Salon  Personal  Beauty Salon  new used   Services 
1560731,39.300862,-102.270722, NAPA Auto Parts  Autos & Motor Vehicles  Auto Supplies  automobile parts   Retail Goods 
1560801,40.084158,-102.149973, Start To Finish Specialties  Shopping  Gifts & Souvenirs  horse specialty   Retail Goods 
1560823,40.079823,-102.224286, Apria Healthcare  Wholesale  Chemicals & Plastics  oxygen   Manufacturing & Wholesale Goods 
1560837,38.820736,-102.347162, Java Enterprise  Professional  Accounting & Tax Preparation  return filing   Services 
1560888,40.638561,-102.630058, Judy's  Personal  Beauty Salon  psychologist   Services 
1560989,40.585649,-102.302526, Woody's Pivot Svc  Wholesale  Machinery & Supplies  equipment irrigation system   Manufacturing & Wholesale Goods 
1561093,38.088284,-102.615281, High Plains Insurance Agency  Insurance  Insurance Agent  cleaners   Services 
1561218,39.301053,-102.604987, St Charles Catholic Church  Organizations  Religious Organization  church   Services 
1561464,39.818923,-102.108764, High Plains Plumbing & Heating  Building & Trades  Plumbing  contractor   Services 
1561476,39.345135,-102.31742, Parrish Drilling  Building & Trades  Construction  water well drilling merchandise   Services 
1561513,40.0753,-102.226427, WRAY Golf Shop  Sports & Exercise  Golf  course   Entertainment 
1561562,40.574056,-102.303625, Assembly Of God  Organizations  Religious Organization  church   Services 
1561623,39.305686,-102.25891, Fay Knapp Farm  Farming  Livestock Farm  beef feedlot cattle   Manufacturing & Wholesale Goods 
1561683,39.611455,-102.591998, Home Agency  Insurance  Insurance Agent  software   Services 
1561701,39.301265,-102.602858, Plains Diesel Svc  Retail  Auto Repair  truck   Services 
1561759,38.087019,-102.620408, Lower Arkansas Water Mgmt  Professional  Business Services  water conservation   Services 
1562018,39.307985,-102.256352, Pieper & Sons  Insurance  Insurance Agent  surveyor   Services 
1562116,39.317427,-102.353517, Randall Peterson  Farming  Farm  crop general   Manufacturing & Wholesale Goods 
1562334,39.703731,-102.291656, High Plains Disposal  Utilities  Refuse  system   Services 
1562360,40.075508,-102.613827, Yuma County Grain Company Inc  Wholesale  Farm Supplies  equipment gen special   Manufacturing & Wholesale Goods 
1562451,38.088097,-102.619044, Carla's Dress Shop  Shopping  Clothing  Apparel  & Fashions  upholsterer   Retail Goods 
1562457,40.992854,-102.265003, Pfau & Sons Mfg  Manufacturing  Rubber & Plastics  product refrigeration fabricated mfg   Manufacturing & Wholesale Goods 
1562546,40.077735,-102.230198, Brophy Realty  Real Estate  Real Estate Agent  dept sewer   Services 
1562606,39.173445,-102.110536, Green Valley Inc  Farming  Farm  special   Manufacturing & Wholesale Goods 
1562773,40.524576,-102.110093, Kramer Feedlot  Farming  Livestock Farm  feeding   Manufacturing & Wholesale Goods 
1562774,38.084338,-102.613316, Charles D Kelley DDS  Health Services  Doctor  dentist   Services 
1562795,38.087305,-102.617784, Wyatt Realty  Real Estate  Real Estate Agent  operator tour   Services 
1562825,38.074366,-102.61789, Deb's Near New Shoppe  Shopping  Clothing  Apparel  & Fashions  contractor   Retail Goods 
1562882,38.07987,-102.618503, Prowers County Nurse  Government  Office  apartment   Public Place 
1562887,38.091308,-102.620866, Tri-State Body Shop  Retail  Auto Repair  body automobile painting   Services 
1562957,39.30325,-102.287203, Hardcraft Homes  Building & Trades  Construction  home builder   Services 
1563244,38.088263,-102.619442, Quality Dry Cleaners  Retail  Laundry & Dry Cleaning  cleaners   Services 
1563307,37.374668,-102.448685, Vilas School  Education  School  church   Public Place 
1563407,40.101535,-102.227382, L & L Implement  Wholesale  Machinery & Supplies  tractor   Manufacturing & Wholesale Goods 
1563419,40.642146,-102.62862, Smith Hardware  Home & Garden  Hardware  physician surgeon   Retail Goods 
1563442,39.303587,-102.287503, Shirley James Trust  Banks & Credit Unions  Financial Services  trust management   Services 
1563479,40.986076,-102.265218, Ingram Electric Motor Repair  Wholesale  Electrical  electric motor   Manufacturing & Wholesale Goods 
1563554,38.074306,-102.629138, Bob Randle Realty  Real Estate  Real Estate Agent  appraiser   Services 
1563557,38.081085,-102.616083, Little People Preschool  Social Services  Child Care  kindergarten academic school   Services 
1563576,40.641966,-102.632668, Haxtun Housing Authority  Real Estate  Real Estate Agent  authorities housing   Services 
1563710,37.386984,-102.278217, Walsh Auto Supply Inc  Autos & Motor Vehicles  Auto Supplies  automobile parts   Retail Goods 
1563722,38.056132,-102.6106, Normandy Gardens  Real Estate  Real Estate Operator  apartment complex   Services 
