1425771,38.375943,-102.196867, Schmidt Farm  Farming  Farm  crop general   Manufacturing & Wholesale Goods 
1425884,38.088608,-102.598415, Southeastern Colorado Co-Op  Freight    grain elevator   Transportation 
1426017,39.916683,-102.082316, Kidz On Main Inc  Shopping  Clothing  Apparel  & Fashions  family   Retail Goods 
1426112,38.101237,-102.618329, Temple Grain  Wholesale  Farm Supplies  grain   Manufacturing & Wholesale Goods 
1426296,38.172616,-102.585376, Country Side Enterprises  Wholesale  Farm Supplies  alfalfa hay   Manufacturing & Wholesale Goods 
1426364,40.963454,-102.387236, Revers High School  Education  School  art gallery dealer   Public Place 
1426439,38.613245,-102.611121, Double T Ranch  Farming  Livestock Farm  ranch   Manufacturing & Wholesale Goods 
1426520,39.309691,-102.269473, Rouse Electric  Building & Trades  Construction  excavating contractor   Services 
1426705,40.066516,-102.226737, Hitch'n Post  Travel  Campground  photographer   Entertainment 
1426933,39.300104,-102.334816, Wagner Equipment Ag Sales  Manufacturing  Tools & Machinery  farm equipment   Manufacturing & Wholesale Goods 
1427077,39.300611,-102.303953, Millennium Construction Co  Building & Trades  Construction  contractor   Services 
1427129,38.07185,-102.625299, De Cant Apartments  Real Estate  Real Estate Operator  apartment   Services 
1427145,39.307919,-102.269429, Eastern Co Bail Bonding  Insurance  Hazard Insurance  bond   Services 
1427317,40.584261,-102.206218, Elm Creek Farms LTD  Farming  Farm  crop general   Manufacturing & Wholesale Goods 
1427426,40.841313,-102.11303, Bauerle Farms  Farming  Livestock Farm  beef feedlot cattle   Manufacturing & Wholesale Goods 
1427489,37.40942,-102.619309, Springfield Childcare Ctr  Social Services  Child Care  mortgage loan broker real estate   Services 
1427593,39.272507,-102.484009, Warrior Aviation  Farming  Farm & Veterinary Services  crop   Manufacturing & Wholesale Goods 
1427741,39.305866,-102.267592, K&D Welding Shop  Retail  Repair Shop  trade welding contractor   Services 
1427745,38.088447,-102.619363, Jolie Fashions  Shopping  Clothing  Apparel  & Fashions  therapist physical   Retail Goods 
1427866,38.07889,-102.613482, Bigbee Real Estate Inc  Real Estate  Real Estate Agent  inspection   Services 
1427954,40.645016,-102.636026, Potter's Septic Svc  Building & Trades  Plumbing  tank septic   Services 
1427956,38.076669,-102.622137, Kar Products  Wholesale  Hardware  tank septic   Manufacturing & Wholesale Goods 
1428037,39.404775,-102.221612, Dusty Road Impressions  Professional    attorney   Services 
1428073,39.463181,-102.352502, Mangus Aviation  Airport    support airline   Transportation 
1428095,37.398509,-102.616518, Southeast Colorado Veterinary  Retail  Veterinary Services  veterinarian   Services 
1428166,40.130626,-102.604945, Pen-Ten Truck Wash Co  Retail  Car Wash  truck cleaning   Services 
1428308,39.28675,-102.607427, Ldp Inc  Professional    establishment   Services 
1428446,40.640318,-102.626801, Edwards Concrete Productions  Building & Trades  Construction  concrete contractor   Services 
1428484,38.089154,-102.620611, Lady-Saver Coin Operated  Retail  Self-service Laundry  oil   Services 
1428614,40.856306,-102.382486, Peterson Brothers Sales  Building & Trades  Construction  commercial contractor   Services 
1428743,39.305876,-102.275808, Immanuel Lutheran Church  Organizations  Religious Organization  church   Services 
1428779,39.708028,-102.310795, Idalia Fire Dept  Government  Fire Station  department   Public Place 
1428994,38.802126,-102.33215, Wrench Wizard  Retail  Auto Repair  truck   Services 
1429013,39.302849,-102.270756, Kit Carson Useful Public Svc  Government  Office  repairing automobile   Public Place 
1429162,38.054306,-102.614488, Prairieview Skateland  Recreation    skating rink   Entertainment 
1429164,38.092366,-102.616765, Toni's Antique & Stuff  Shopping  Used Merchandise  antique   Retail Goods 
1429242,40.808429,-102.566857, Precision Products  Wholesale  Metals & Minerals  center   Manufacturing & Wholesale Goods 
1429250,39.335868,-102.267879, Buol John Feeding Co Inc  Farming  Livestock Farm  beef feedlot cattle   Manufacturing & Wholesale Goods 
1429252,39.303509,-102.26894, Preventive Family Dental  Health Services  Doctor  dentist   Services 
1429393,40.078728,-102.227607, Quality Farm & Ranch/Ace  Home & Garden  Hardware  loan real estate   Retail Goods 
1429557,40.07776,-102.223488, Soothing Soles Massage Clinic  Health Services  Health Practitioner  spa medical   Services 
1429780,39.214303,-102.277709, Pekarek's Building Designs  Real Estate  Architect  illustrator architectural   Services 
1429863,37.324012,-102.216186, Kevin Hefley  Farming  Farm  crop general   Manufacturing & Wholesale Goods 
1430046,40.077744,-102.222162, Strawberry Patch  Food & Beverages  Specialty  transportation engineer   Retail Goods 
1430185,40.982302,-102.267776, Amherst Co-Operative Elevator  Wholesale  Farm Supplies  bean grain elevator   Manufacturing & Wholesale Goods 
1430190,38.075252,-102.619818, Southeastern Land & Environmen  Government  Office  operator local trucking   Public Place 
1430219,40.077788,-102.227444, St Andrew's Catholic Church  Organizations  Religious Organization  church   Services 
1430224,38.075252,-102.619818, Gerald A Branes DDS  Health Services  Doctor  dentist   Services 
1430333,38.088127,-102.620639, Gonzales Insurance  Insurance  Insurance Agent  propeller   Services 
1430451,39.444466,-102.426851, Eugene Weiss  Farming  Farm  crop general   Manufacturing & Wholesale Goods 
1430481,39.975618,-102.429838, Bar H K Farms  Farming  Farm  crop general   Manufacturing & Wholesale Goods 
1430559,40.073353,-102.227022, Church Of Christ  Organizations  Religious Organization  church   Services 
1430676,38.128871,-102.59943, Alta Vista Charter School  Education  School  restoration cleaning patio deck   Public Place 
1430710,39.30424,-102.272046, Hilt Farm  Farming  Farm  crop general   Manufacturing & Wholesale Goods 
1430747,39.301063,-102.272113, Ultimate Spa & Fitness Inc  Sports & Exercise  Gym  spa health   Entertainment 
1430768,40.542361,-102.244353, Marcus Schlachter  Farming  Farm  crop general   Manufacturing & Wholesale Goods 
1430975,40.806735,-102.59388, Bhd Construction and Farm  Building & Trades  Construction  house   Services 
1431126,40.072055,-102.232375, Seward Trucking  Freight    operator local trucking   Transportation 
1431138,40.59306,-102.304724, Holyoke Super  Food & Beverages  Groceries & Convenience Stores  grocer   Retail Goods 
1431149,38.089309,-102.61943, Daniels Construction Company  Building & Trades  Construction  new family home   Services 
1431156,40.083891,-102.222015, Cerbs Appraisal Service  Real Estate  Real Estate Agent  farm landscaping supp contractor equipment excavation   Services 
1431221,39.240134,-102.48366, Will Wagon Travel  Farming  Livestock Farm  beef feedlot cattle   Manufacturing & Wholesale Goods 
1431354,38.143274,-102.622581, Dick's Neon  Manufacturing  Signs  mfg contractor specialty trade   Manufacturing & Wholesale Goods 
1431563,39.947128,-102.315467, US Post Office  Government  Post Office  product manufacturer   Public Place 
1431588,38.092081,-102.619344, Lamar Building Material Supply  Home & Garden  Building Materials  bathtub sink refinishing   Retail Goods 
1431598,37.405016,-102.616597, Gale Drug  Shopping  Pharmacy  drug store   Retail Goods 
1431611,39.731126,-102.310632, Rick Zion  Farming  Farm  crop general   Manufacturing & Wholesale Goods 
1431649,38.084072,-102.617611, Joe's Sewerooter Svc  Building & Trades  Plumbing  septic   Services 
1432008,38.816502,-102.35534, Trail Inn Motel  Travel  Hotels & Motels  track running tennis court   Entertainment 
1432125,38.077157,-102.61848, Perfect Ten Plus  Sports & Exercise  Gym  fitness physical facility   Entertainment 
1432197,38.82074,-102.347705, Petersen-Smith Hardware  Home & Garden  Hardware  automotive parts tire   Retail Goods 
1432332,38.09129,-102.61935, 5-E Liquors  Food & Beverages  Liquor & Beverages  beer wine   Retail Goods 
1432450,39.304631,-102.266591, Williams Machinery Supply  Retail  Repair Shop  equipment welding electrical furniture   Services 
1432467,39.311184,-102.269464, Kit Carson County Shop Dist  Government  Office  television radio   Public Place 
1432675,38.088162,-102.619047, Tice Randa Davis  Professional  Lawyer & Legal Services  attorney   Services 
1432692,38.05823,-102.616683, Natural Resources Conservation  Government  Office  federal   Public Place 
1433017,38.143274,-102.622725, Ausmus Builders Inc  Building & Trades  Construction  house   Services 
1433143,38.820216,-102.350141, Baby Bear Hugs  Professional    establishment   Services 
1433198,39.812556,-102.069833, Erker Grain Company  Wholesale  Groceries  confectionery   Manufacturing & Wholesale Goods 
1433284,39.427941,-102.352579, Bar JB Ranch  Farming  Livestock Farm  animal general   Manufacturing & Wholesale Goods 
1433324,37.405545,-102.616455, Radio Shack & Self Sales  Shopping  Computers & Home Electronics  equipment electronic supply   Retail Goods 
1433326,37.384176,-102.615535, Crossroads Travel Plaza  Autos & Motor Vehicles  Fuel & Gas Station  station gasoline   Retail Goods 
1433446,38.086124,-102.619197, Cellular One  Utilities  Mobile Phone  communication radiotelephone   Services 
1433511,37.403747,-102.616596, Stage Stop Hotel  Travel  Hotels & Motels  operation eating   Entertainment 
1433629,40.578459,-102.286539, Holyoke Mobile Home & Rv Park  Real Estate  Real Estate Operator  mobile home community   Services 
1433725,39.299046,-102.270773, Combined Court Clerk  Government  Court House  retail eating direct sales   Public Place 
1433997,37.38751,-102.61635, Kar-Vu Drive In Theatre  Cinema  Movie Theater  sun goggles sunglasses   Entertainment 
1434093,40.585864,-102.300752, Lions Den  Professional    establishment   Services 
1434152,38.086146,-102.619198, Total Home Improvement Svc LLC  Building & Trades  Construction  house   Services 
1434156,40.579682,-102.307751, TNT Pest Control  Building & Trades  Pest Control  home builder   Services 
1434296,37.404165,-102.616017, Deen's Automotive  Retail  Auto Repair  repairing automobile   Services 
1434922,40.071425,-102.232976, Jdt Farms LLC  Farming  Farm  crop general   Manufacturing & Wholesale Goods 
1434933,40.080666,-102.22201, Plains Repair & Paints  Retail  Repair Shop  related   Services 
1435065,39.291249,-102.614057, James R Foose  Professional    executive   Services 
1435134,37.031937,-102.21759, Dennis J Tevebaugh Livestock  Wholesale  Farm Supplies  livestock   Manufacturing & Wholesale Goods 
1435461,40.078833,-102.220652, Northeast Colorado Health Dept  Health Services  Doctor  clinic   Services 
1435482,38.092396,-102.618182, Heath & Son & Turpin Trucking  Retail  Auto Repair  truck   Services 
1435567,40.987026,-102.264606, Julesburg Tavern  Bars & Pubs    carpentry contractor   Food & Drink 
1435822,37.407322,-102.616464, L E Service  Autos & Motor Vehicles  Fuel & Gas Station  station gasoline   Retail Goods 
1435860,38.770467,-102.332063, High Plains Commodities  Education  School  instruction yoga   Public Place 
1435916,37.325659,-102.615459, Higgins Ranch Partnership  Farming  Livestock Farm  real beef lessor cattle property feedlot   Manufacturing & Wholesale Goods 
1435922,40.582282,-102.283046, STC Corp  Freight    trucking   Transportation 
1435932,38.088318,-102.615272, Creative Media Concepts  Manufacturing  Printing  multimedia   Manufacturing & Wholesale Goods 
1435985,38.085989,-102.618877, Valley State Bank  Banks & Credit Unions  Bank  electric contractor   Services 
1436114,38.072963,-102.623793, Jehovah's Witnesses  Organizations  Religious Organization  church   Services 
1436143,39.302471,-102.279839, Rod Moller Trucking Inc  Freight    operator local trucking   Transportation 
1436373,39.444161,-102.593806, Colorado Soy  Manufacturing  Pet Food  feed   Manufacturing & Wholesale Goods 
1436411,40.176496,-102.303087, Wilson Ranch  Farming  Livestock Farm  animal general   Manufacturing & Wholesale Goods 
1436444,39.054892,-102.600871, Jim Mc Cormick Feed Lot  Farming  Farm & Veterinary Services  breeder livestock   Manufacturing & Wholesale Goods 
1436470,38.083041,-102.618923, Lamar Middle School  Education  School  energy conservation prod   Public Place 
1436546,38.815727,-102.369376, County Shop  Government  Office  investor   Public Place 
1436676,40.249915,-102.547379, Alliance Farms Co-Op Assoc  Real Estate  Real Estate Agent  cooperative   Services 
1436721,38.076003,-102.61832, B J's Burger & Beverage  Restaurant    house   Food & Drink 
1436723,38.052314,-102.123932, St Frances Of Rome  Organizations  Religious Organization  church   Services 
1436734,37.384382,-102.280681, Walsh Health Care Ctr  Health Services  Nursing And Care Facility  home convalescent   Services 
1436937,38.085309,-102.635267, Out West Equioment Co  Utilities  Refuse  system   Services 
1436987,39.305174,-102.263961, Burlington Elementary School  Education  School  club health studio gymnasium   Public Place 
1436988,37.411135,-102.613495, Seventh Day Adventist Church  Organizations  Religious Organization  church   Services 
1437028,38.089515,-102.611195, M R Rife Earthmoving  Building & Trades  Construction  specializing land leveling contractor   Services 
1437059,37.148462,-102.240563, Brown John  Farming  Livestock Farm  beef feedlot cattle   Manufacturing & Wholesale Goods 
1437097,38.084399,-102.614107, Lawn Co  Building & Trades  Landscaping Services  lawn maintenance grounds   Services 
1437137,38.090288,-102.619494, Allen's TV & Appliance  Home & Garden  Household Appliances  glass window plate   Retail Goods 
1437390,38.05101,-102.12266, Holly Post Office  Government  Post Office  postal us   Public Place 
1437539,39.871371,-102.466202, Keller Cattle Co  Farming  Farm & Veterinary Services  breeder livestock   Manufacturing & Wholesale Goods 
1437576,39.301008,-102.277962, Sonic Drive-In  Restaurant    eating   Food & Drink 
1437582,40.07802,-102.222263, Plains Insurance  Insurance  Insurance Agent  physician surgeon   Services 
1437620,38.080041,-102.411618, David Heck  Farming  Farm  crop general   Manufacturing & Wholesale Goods 
1437666,37.404037,-102.614295, Southeast Colorado Hspt Pt  Health Services  Hospital  general   Services 
1438031,38.054503,-102.605217, R M Hiner Construction  Building & Trades  Construction  pipe line contractor   Services 
1438173,37.404061,-102.617864, Cooper's Hometown Brand Ctr  Home & Garden  Household Appliances  fire restoration damage contractor   Retail Goods 
1438180,40.73477,-102.559131, Troy Anderson Trucking  Freight    trucking   Transportation 
1438322,40.078667,-102.222154, Town & Country Shoes Inc  Shopping  Shoes  shoe store   Retail Goods 
1438434,39.304949,-102.267951, American Financial  Banks & Credit Unions  Investment Brokerage  advisory financial   Services 
1438467,40.938163,-102.524903, Platte Valley Grade School  Education  School  house   Public Place 
1438473,40.078928,-102.222078, Hinkle's Insurance Agency Inc  Insurance  Insurance Agent  home residential   Services 
1438531,38.053469,-102.134824, Colorado Wholesale Stoves  Wholesale  Toys & Hobbies  wholesaler   Manufacturing & Wholesale Goods 
1438691,40.585669,-102.299434, D & J Hardware  Home & Garden  Hardware  rehabilitation center   Retail Goods 
1438817,38.8234,-102.346123, Smoky River Golf Course  Sports & Exercise  Golf  course   Entertainment 
1438842,40.078927,-102.226813, 7-Eleven  Food & Beverages  Groceries & Convenience Stores  youth organization center   Retail Goods 
1438859,38.077922,-102.618257, River City Auto  Autos & Motor Vehicles  Automobile Sales  used   Retail Goods 
1438942,37.398587,-102.616444, Baca Welding Inc  Building & Trades  Construction  hardware repair welding m contractor   Services 
1438991,38.081634,-102.610579, Larrys Electric Service Inc  Building & Trades  Electrical  electrical contractor   Services 
1439060,39.301056,-102.647143, Imagery By Kathleen  Home & Garden  Home Furnishings  tutoring   Retail Goods 
1439125,39.303989,-102.268109, Bits N Pieces  Shopping  Gifts & Souvenirs  repairing automobile   Retail Goods 
1439198,38.09131,-102.616853, Western Brake & Gear Inc  Autos & Motor Vehicles  Auto Supplies  clinic   Retail Goods 
1439263,39.612566,-102.600104, Frank Ervin & Kathy Farms  Farming  Farm  crop general   Manufacturing & Wholesale Goods 
1439298,40.075317,-102.257414, Wray Garden Center  Shopping  Florist  distribution   Retail Goods 
1439303,38.039303,-102.60737, Mike Pearson & Lorraine  Building & Trades  Construction  water well drilling   Services 
1439406,39.659049,-102.251421, Moellenberg Ranch  Farming  Farm  crop general   Manufacturing & Wholesale Goods 
1439467,38.821556,-102.348623, Eastern Colorado Insurance  Insurance  Insurance Agent  baker   Services 
1439486,40.082698,-102.194063, Central Locator Svc  Professional    repairing automobile   Services 
1439530,40.994391,-102.262987, Michael Bashore  Professional    home   Services 
1439591,39.32593,-102.241634, Kugler Oil Co  Wholesale  Farm Supplies  fertilizer   Manufacturing & Wholesale Goods 
1439658,38.101237,-102.618329, Robert's Computer Maintenance  Shopping  Computers & Home Electronics  equipment dealer   Retail Goods 
1439822,39.303127,-102.264135, 1st St Paul Luth Chr Parsonage  Organizations  Religious Organization  church   Services 
1439947,37.405418,-102.616453, Ray's Recreation  Recreation    amusement   Entertainment 
1440119,38.071475,-102.627822, Mary & Martha Ministries  Organizations  Religious Organization  company sewage   Services 
1440142,39.307352,-102.267929, Kit Carson Communications Ctr  Government  Office  village   Public Place 
1440181,38.82452,-102.355614, Hapes Garage  Retail  Auto Repair  repairing automobile   Services 
1440245,39.626827,-102.649689, Arikaree GWM District  Professional  Management & Consulting  consultant   Services 
1440365,37.103011,-102.578008, Campo Community Ctr  Recreation    center   Entertainment 
1440369,39.301249,-102.607471, Isenbart's Dental Clinic  Health Services  Doctor  dentist   Services 
1440379,38.47157,-102.082444, Bartlett Grain Co LP  Freight    grain elevator   Transportation 
1440398,40.98271,-102.27742, Larsen Lawn Care  Building & Trades  Landscaping Services  invention research   Services 
1440418,40.586732,-102.296195, Auction Service  Professional  Business Services  auctioneer   Services 
1440436,40.078587,-102.222154, Leigh Floral & Gift/Shutterbug  Shopping  Florist  farm equipment landscaping   Retail Goods 
1440627,38.087078,-102.620487, Shinn Steerman & Shinn  Professional  Lawyer & Legal Services  attorney   Services 
1440703,38.080884,-102.618709, Kogovsek Law Firm PC  Professional  Lawyer & Legal Services  attorney   Services 
1440738,39.988002,-102.203937, Endless Entrys  Professional  Accounting & Tax Preparation  bookkeeping general   Services 
1440944,40.074014,-102.221557, Mc Donald Physical Therapy Ctr  Health Services  Health Practitioner  therapist physical   Services 
1440967,39.775829,-102.066222, Bob Hansen  Farming  Farm  crop general   Manufacturing & Wholesale Goods 
1441076,38.088252,-102.619352, Amy's Fashions  Shopping  Clothing  Apparel  & Fashions  dentist   Retail Goods 
1441247,40.904233,-102.517222, Lucy's Place  Restaurant    eating   Food & Drink 
1441310,39.304408,-102.605072, Eagles Landing Sports Bar  Restaurant    counselor marriage family   Food & Drink 
1441359,37.41036,-102.616553, Longhorn Steakhouse Inc  Restaurant    eating   Food & Drink 
1441717,38.086966,-102.620555, Lamar Daily News  Manufacturing  Printing  newspaper   Manufacturing & Wholesale Goods 
1441747,40.112605,-102.056587, Wilder Farms 42  Farming  Farm  soybean   Manufacturing & Wholesale Goods 
1441828,39.297836,-102.603708, Trail's End Campground  Travel  Campground  direct merchandise sales   Entertainment 
1441931,40.076023,-102.260755, Pizza Factory  Restaurant    consultant   Food & Drink 
1441969,38.088153,-102.620565, John Gehlhausen Law Offices  Professional  Lawyer & Legal Services  attorney   Services 
1441975,40.990751,-102.273467, Julesburg Housing Authority  Real Estate  Real Estate Operator  apartment   Services 
1441996,37.406324,-102.626987, Tri-County Electric  Building & Trades  Electrical  electric contractor   Services 
1442226,39.303819,-102.26796, Kit Carson County Attorney  Professional  Lawyer & Legal Services  attorney   Services 
1442271,38.098806,-102.618824, M & M Auto Plus  Professional    establishment   Services 
1442431,38.071131,-102.621336, Lamar Sda School  Education  School  mfg   Public Place 
1442564,40.543536,-102.359792, Z&L Farms  Farming  Farm & Veterinary Services  livestock   Manufacturing & Wholesale Goods 
1442700,39.303229,-102.603649, Stratton Public Library  Education  Library  attorney   Public Place 
1442735,39.301091,-102.269234, Burlington Radiator & Acces  Retail  Auto Repair  repairing automobile radiator   Services 
1442751,38.088547,-102.60976, Fellowship Credit Union  Banks & Credit Unions  Bank  pawnbroker   Services 
1442770,40.987432,-102.261598, Sedgwick County Day Svc  Social Services  Job Training  retardation disabled mental dev   Services 
1442780,38.850442,-102.090104, Donald Aldridge  Farming  Livestock Farm  beef feedlot cattle   Manufacturing & Wholesale Goods 
1442788,37.27922,-102.6154, Deeds Cattle Co  Farming  Farm & Veterinary Services  vet   Manufacturing & Wholesale Goods 
1442801,40.078019,-102.22251, Unique Kut's  Personal  Beauty Salon  machine shop jobbing repair   Services 
1442855,39.300845,-102.272511, Kleine Motor Co  Retail  Auto Repair  wrecker   Services 
1442973,38.088509,-102.613749, Prowers Senior Opportunities  Government  Office  security   Public Place 
1443140,40.585083,-102.300835, Nygaard Chiropractic Office  Health Services  Chiropractor  bookkeeping general   Services 
1443229,40.582986,-102.283054, Max Brown Farm Shop  Farming  Farm  crop   Manufacturing & Wholesale Goods 
1443369,40.15937,-102.199404, Robert Crossland  Farming  Livestock Farm  beef feedlot cattle   Manufacturing & Wholesale Goods 
1443400,40.974703,-102.364039, Donald Schneider  Farming  Farm  crop general   Manufacturing & Wholesale Goods 
1443406,39.658192,-102.536769, Doddridge Farms  Farming  Livestock Farm  beef feedlot cattle   Manufacturing & Wholesale Goods 
1443468,39.305901,-102.262824, Briegel & Briegel  Shopping    cosmetic perfume   Retail Goods 
1443521,40.03938,-102.375928, Lions Club of Julesburg  Organizations  Community Association  environmental ecological   Services 
1443547,38.087166,-102.619056, Probation Dept  Social Services    probation   Services 
1443557,38.413729,-102.097226, Ss Shiloh  Farming  Farm  lithographic commercial   Manufacturing & Wholesale Goods 
1443561,38.122356,-102.219794, Southeastern Colorado Co-Op  Freight    grain elevator   Transportation 
1443827,39.301476,-102.277157, Burlington Care Center Inc  Restaurant    residential eating care   Food & Drink 
1443874,37.391161,-102.616555, Jeff Woller Towing & Auto Prts  Wholesale  Auto Parts  automobile rebuilt   Manufacturing & Wholesale Goods 
1443887,38.086321,-102.619209, Alamo Apartments  Real Estate  Real Estate Operator  building apartment   Services 
1444010,40.078833,-102.220652, Drivers License Office  Government  Office  driver license   Public Place 
1444306,38.088395,-102.609949, A & B Liquors Inc  Food & Beverages  Liquor & Beverages  alcoholic   Retail Goods 
1444427,40.098513,-102.227521, Larsen Fresh  Professional    establishment   Services 
1444470,40.585631,-102.294176, Hugs & Tugs Day Care  Social Services  Child Care  taping   Services 
1444495,39.612386,-102.592111, KIRK Food Store  Food & Beverages  Groceries & Convenience Stores  grocer   Retail Goods 
1444596,39.616322,-102.592063, KIRK Ambulance Svc  Local Transit    ambulance   Transportation 
1444627,39.24292,-102.61447, Cpr Resources LLC  Professional    recycling center   Services 
1444811,38.851018,-102.089677, Mark Aldridge  Farming  Farm  crop general   Manufacturing & Wholesale Goods 
1444870,38.096453,-102.619787, Kmart  Shopping  Department Store  federal agency   Retail Goods 
1444924,40.986835,-102.262585, Equitable Savings & Loan Assn  Banks & Credit Unions  Bank  loan real estate   Services 
1445046,38.07987,-102.618503, Social Security Administration  Government  Office  federal human   Public Place 
1445202,38.093574,-102.619745, Checker Auto Parts 1345  Autos & Motor Vehicles  Auto Supplies  automobile parts   Retail Goods 
1445232,38.079901,-102.615281, Lamar Swimming Pool  Recreation    pool swimming   Entertainment 
1445279,40.066238,-102.226732, Cornerstone Production Co  Wholesale  Fruits & Vegetables  potato   Manufacturing & Wholesale Goods 
1445382,40.996936,-102.318287, R Lawn  Building & Trades  Landscaping Services  lawn maintenance grounds   Services 
1445468,39.296329,-102.278815, Dynamite Cleaning/Restoration  Building & Trades  Cleaning & Sanitation  janitor   Services 
1445475,40.749406,-102.375441, Northeast Feed Inc  Wholesale  Farm Supplies  feed   Manufacturing & Wholesale Goods 
1445484,38.087303,-102.617825, Kennedy & Coe  Professional  Accounting & Tax Preparation  accountant   Services 
1445492,39.302719,-102.288172, High Plains Capital Mortgage  Banks & Credit Unions  Bank  loan real estate   Services 
1445657,38.088267,-102.619338, H & R Block Tax Svc  Professional  Accounting & Tax Preparation  return filing   Services 
1445677,40.08006,-102.216783, D JS Archies  Bars & Pubs    drinking   Food & Drink 
1445728,38.054242,-102.129893, SKC Accounting Svc  Professional  Accounting & Tax Preparation  bookkeeping general   Services 
1445845,38.087352,-102.613748, Spar Clean  Professional    establishment   Services 
