21928,35.208092,-101.857231, CHE  Manufacturing  Metals  boiler   Manufacturing & Wholesale Goods 
21985,35.206909,-101.838295, OHMS Cafe & Catering  Restaurant    eating   Food & Drink 
21995,35.204983,-101.854574, Coleman Taylor Co  Health Services  Doctor  physician surgeon   Services 
22370,35.205824,-101.831064, Parks & Recreation Dept Comm  Recreation    amusement   Entertainment 
22529,35.205812,-101.837381, BJ Services Company  Manufacturing  Chemicals & Compounds  field mfg   Manufacturing & Wholesale Goods 
22552,35.209469,-101.843015, Tri-State Parts Warehouse  Wholesale  Auto Parts  automobile supply   Manufacturing & Wholesale Goods 
22571,35.207364,-101.850556, Bgt Productions  Home & Garden  Household Appliances  electronics consumer   Retail Goods 
22905,35.20505,-101.849338, William K Paschal  Professional  Lawyer & Legal Services  attorney   Services 
22928,35.206148,-101.841207, Delta Electronics  Retail  Repair Shop  equipment electronic supply   Services 
23254,35.205058,-101.85423, Tots Villa Drop-A-Tot  Social Services  Child Care  school day   Services 
23301,35.197499,-101.840305, Lutz Decorating Center  Professional  Business Services  electronic   Services 
23395,35.199386,-101.846424, A John Doucette CPA  Professional  Accounting & Tax Preparation  shop   Services 
23397,35.205936,-101.838641, Buckner Building Svc Inc  Building & Trades  Construction  contractor   Services 
23434,35.204749,-101.846484, Lubbock Office Supplies  Wholesale  Office Equipment  machine duplicating copying   Manufacturing & Wholesale Goods 
23789,35.208492,-101.851593, Rogers Auto Body Repairing  Retail  Auto Repair  body automobile painting general   Services 
23902,35.206272,-101.84343, Pantera Energy Co  Mining & Drilling    development gas oil exploration producer   Manufacturing & Wholesale Goods 
24232,35.205748,-101.84633, Patrick Henry Group  Professional  Management & Consulting  consultant business   Services 
24480,35.204999,-101.865164, Patterson & Ellett  Professional  Engineering  engineer   Services 
24487,35.20879,-101.837992, U S Legal Support  Professional  Business Services  process server   Services 
24826,35.205772,-101.838463, Modern Woodmen Of America  Insurance  Insurance Agent  graphic counselor design   Services 
24850,35.210714,-101.843936, Endless Services Property Main  Utilities    sanitary   Services 
24926,35.206379,-101.84362, West Panhandle Field Resources  Mining & Drilling    oil well   Manufacturing & Wholesale Goods 
24974,35.206474,-101.843681, Lions Club-Downtown Amarillo  Organizations  Community Association  civic   Services 
24984,35.201404,-101.84596, Berneta Communications Inc  Communications  Film & Video Production  audio   Services 
25675,35.201775,-101.840682, St Mark's Anglican Episcopal  Organizations  Religious Organization  church   Services 
25799,35.205824,-101.831064, Amarillo Code Enforcement  Government  Office  village   Public Place 
25809,35.205936,-101.838641, Calvary Consulting LLC  Mining & Drilling    development gas oil exploration   Manufacturing & Wholesale Goods 
25865,35.203935,-101.848245, Norman Antiques & Art  Wholesale  Durable Goods & Equipment  group   Manufacturing & Wholesale Goods 
25901,35.197913,-101.84269, Connections Information System  Professional  Computer Services  marble   Services 
25987,35.205824,-101.831064, Amarillo Public Works  Government  Office  city   Public Place 
26047,35.20879,-101.837992, Hunter Kalinke & Boyd Law Ofc  Professional  Lawyer & Legal Services  attorney   Services 
26129,35.209661,-101.836543, Resolution Consulting Inc  Professional  Management & Consulting  consultant   Services 
26195,35.199798,-101.842387, Sisters By Heart Gift Shop  Shopping  Gifts & Souvenirs  shop   Retail Goods 
26214,35.210329,-101.849968, Binswanger Glass Co  Home & Garden  Building Materials  glass window plate   Retail Goods 
26228,35.209661,-101.836543, Rural Community Health Systems  Health Services  Clinic  clinic   Services 
26544,35.210385,-101.841453, S & S Roofing Inc  Building & Trades  Construction  contractor   Services 
26763,35.207909,-101.847234, Moncor Technologies Inc  Shopping  Computers & Home Electronics  software   Retail Goods 
27005,35.203608,-101.838886, State Farm Insurance  Insurance  Insurance Agent  department   Services 
27039,35.205058,-101.853271, Nails By Diana-Headquarters  Personal  Beauty Salon  manicuring   Services 
27048,35.206909,-101.838295, Technical Temps  Professional  Employment Agencies  used   Services 
27069,35.199132,-101.837332, World Property Team  Real Estate  Real Estate Agent  investment   Services 
27113,35.206595,-101.844793, Business Service Systems  Professional  Accounting & Tax Preparation  billing   Services 
27132,35.197426,-101.831208, Farmers Brothers Coffee  Wholesale  Groceries  tea coffee eating business   Manufacturing & Wholesale Goods 
27230,35.204664,-101.83745, IMS  Utilities  Cable  satellite carrier   Services 
27244,35.204418,-101.844083, Glenn Raef Insurance  Insurance  Insurance Agent  attorney   Services 
27482,35.205936,-101.838641, Entrenched Networks  Professional  Computer Services  church   Services 
27568,35.199132,-101.837332, Top Of Texas AA Group  Organizations  Non-profit Organization  information alcoholism treatment   Services 
27575,35.203708,-101.846642, Thompson Painting  Building & Trades  Construction  hanging contractor   Services 
27718,35.209876,-101.836585, Jhh Properties LLC  Banks & Credit Unions  Financial Services  company holding   Services 
27792,35.205772,-101.838463, Northern Law Firm  Professional  Lawyer & Legal Services  attorney   Services 
27929,35.210988,-101.845422, Eveline Rivers Christmas Prjct  Organizations  Professional Association  equipment electronic supply   Services 
28220,35.206728,-101.8384, Vagrosky Design Group  Professional  Advertising  counselor   Services 
28557,35.207398,-101.84342, Millworks Plus  Home & Garden  Building Materials  equipment commercial   Retail Goods 
28702,35.211811,-101.843779, Langston Memorial Church-God  Organizations  Religious Organization  church   Services 
28706,35.211803,-101.836203, Hawkins Trailer & Equipment Co  Autos & Motor Vehicles  Recreational Vehicle Sales  parts trailer   Retail Goods 
28717,35.206074,-101.85056, Perfection Roofing Materials  Home & Garden  Building Materials  roofing   Retail Goods 
28767,35.205812,-101.837381, MALLORY G Holloway Law Office  Professional  Lawyer & Legal Services  attorney   Services 
28808,35.20534,-101.843824, T C Amarillo LLC  Real Estate  Real Estate Operator  property management rental   Services 
29102,35.205812,-101.837381, Cornerstone Builders  Building & Trades  Construction  general contractor   Services 
29154,35.209661,-101.836543, Tad Fowler  Professional  Lawyer & Legal Services  attorney   Services 
29163,35.205809,-101.839866, Panhandle Geological Log Lib  Mining & Drilling    report oil   Manufacturing & Wholesale Goods 
29176,35.21029,-101.849728, Superior Ironworks  Building & Trades  Construction  general contractor   Services 
29203,35.206794,-101.839497, Meals On Wheels of Amarillo  Social Services    organization welfare   Services 
29228,35.206266,-101.842226, Sir Speedy  Professional  Printing & Photocopies  photocopying   Services 
29246,35.20505,-101.849338, Greta R Crofford  Professional  Lawyer & Legal Services  attorney   Services 
29348,35.210823,-101.83759, Forever Families  Social Services  Adult Care  residential   Services 
29358,35.199331,-101.846138, Top Of Texas Financial Strtgs  Banks & Credit Unions  Investment Brokerage  consultant planning financial   Services 
29478,35.209876,-101.836585, Mitch D Carthel  Professional  Lawyer & Legal Services  attorney   Services 
29589,35.199386,-101.846424, Phobis Computer Software  Professional  Computer Services  prepackaged software   Services 
29715,35.204581,-101.845185, Grateful Inc  Professional    city   Services 
29752,35.20847,-101.859523, RSM Builders Supply Inc  Building & Trades  Construction  specialty   Services 
29773,35.205936,-101.838641, West Co  Real Estate  Real Estate Agent  janitor   Services 
29807,35.203522,-101.837743, Jack M Graham Atty  Professional  Lawyer & Legal Services  establishment   Services 
29988,35.205772,-101.838463, Gerben & Associates  Professional  Art Services  graphic design   Services 
30011,35.207208,-101.850535, Psychiatry Clinic Of Amarillo  Health Services  Doctor  clinic   Services 
30214,35.206443,-101.844721, Woodruff & Moore Realtors  Real Estate  Real Estate Agent  church   Services 
30360,35.209876,-101.836585, Gwinn & Roby  Professional  Lawyer & Legal Services  attorney   Services 
30476,35.203612,-101.830172, T D Rowe Inc  Wholesale  Machinery & Supplies  equipment ride park amusement   Manufacturing & Wholesale Goods 
30507,35.210824,-101.82888, Big State Tire Supply  Wholesale  Auto Parts  used   Manufacturing & Wholesale Goods 
30810,35.206446,-101.844742, Retirement Investment Spec  Banks & Credit Unions  Investment Brokerage  retirement planning   Services 
30914,35.207665,-101.83701, Sell & Griffin PC  Professional  Lawyer & Legal Services  attorney   Services 
30989,35.204999,-101.865164, Primerica Financial Svc  Insurance  Insurance Agent  house   Services 
31000,35.207783,-101.853747, Reliable Life Insurance Co  Insurance  Insurance Agent  ginning cotton supply   Services 
31188,35.206728,-101.8384, Mc Leod USA  Utilities  Telephone  distance long   Services 
31238,35.206909,-101.838295, Stapleton & Associates  Real Estate  Developer  logging   Services 
31252,35.203522,-101.837743, Potter County Information Tech  Government  Office  church   Public Place 
31317,35.205772,-101.838463, E J's Bldg Operation & Ofc Svc  Banks & Credit Unions  Financial Services  company holding   Services 
31465,35.212468,-101.841095, Carter Chapel Methodist Church  Organizations  Religious Organization  church   Services 
31496,35.207513,-101.852828, Noel-Cokendolpher Bookkeeping  Professional  Accounting & Tax Preparation  bookkeeping general   Services 
31688,35.205681,-101.846386, Distinctive Millworks  Building & Trades  Construction  carpentry contractor   Services 
31763,35.197589,-101.841503, Conceptual Detailing Inc  Professional  Business Services  interior consultant design decorator   Services 
31831,35.209661,-101.836543, KZRK AM News Talk 1550  Communications  Radio Station  company broadcasting   Services 
32233,35.205824,-101.831064, Amarillo Parks & Recreation  Recreation    parks   Entertainment 
32282,35.201775,-101.840682, Opportunity School Inc  Social Services  Child Care  school day   Services 
32502,35.207513,-101.852828, Panhandle Community Svc  Social Services    organization welfare   Services 
32616,35.199798,-101.842387, Baptist Community Services  Health Services  Nursing And Care Facility  skilled   Services 
32898,35.205998,-101.850766, ROBERT Madden Inc  Building & Trades  Plumbing  conditioning air system contractor   Services 
32915,35.207599,-101.852889, Extreme Marine  Autos & Motor Vehicles  Boat Sales  dealer sales   Retail Goods 
33249,35.205751,-101.838671, Greyhound Lines Food Servi  Restaurant    eating   Food & Drink 
33258,35.203869,-101.840271, Ngt Credit Union  Banks & Credit Unions  Bank  repairing automobile   Services 
33295,35.20778,-101.85373, Camara De Comercio Hispana  Organizations  Professional Association  chambers commerce   Services 
33637,35.205809,-101.839866, American Communication Service  Professional  Management & Consulting  business   Services 
33837,35.210472,-101.849909, Dealers Electrical Supply  Wholesale  Electrical  equipment electric supply   Manufacturing & Wholesale Goods 
33860,35.211853,-101.845282, Amarillo SPCA  Retail  Animal Services  shelter   Services 
34043,35.205824,-101.831064, Amarillo Vital Statistics  Government  Office  city program health   Public Place 
34166,35.2087,-101.852602, Fullerton Roofing Shop  Building & Trades  Construction  contractor   Services 
34253,35.204999,-101.865164, Amarillo International Chr  Organizations  Religious Organization  church   Services 
34309,35.210044,-101.846725, Great Plains Refinishing Co  Retail  Repair Shop  refinishing furniture   Services 
34393,35.205809,-101.839866, Hispano Weekly  Manufacturing  Printing  newspaper   Manufacturing & Wholesale Goods 
34506,35.208824,-101.83679, Jay O'Brien  Wholesale  Farm Supplies  livestock   Manufacturing & Wholesale Goods 
34734,35.210605,-101.850141, All Pro Maids  Building & Trades  Cleaning & Sanitation  butler maid   Services 
35061,35.205812,-101.837381, Exchange Services Inc  Banks & Credit Unions  Bank  cashing check   Services 
35241,35.197653,-101.841428, Harvey Health Ctr Inc  Health Services  Clinic  pawnbroker   Services 
35297,35.209693,-101.836614, William A Hoy  Professional  Lawyer & Legal Services  attorney   Services 
35325,35.202617,-101.837849, Cathey Fullingim Hardware Co  Home & Garden  Hardware  automobile parts   Retail Goods 
35329,35.206426,-101.827305, Floyd's Amarillo Night Club  Organizations  Community Association  club drinking   Services 
35372,35.20773,-101.853893, New Beginnings Gospel Ctr  Organizations  Religious Organization  church   Services 
35449,35.205928,-101.849672, Savin Corporation  Wholesale  Office Equipment  repair computer facsimile shredder   Manufacturing & Wholesale Goods 
35484,35.20773,-101.853893, Veterans Of Foreign Wars  Organizations  Community Association  military   Services 
35696,35.204908,-101.8533, Stewart Steven Design  Professional  Business Services  heating contractor   Services 
35945,35.206078,-101.849631, Church Of Restoration  Organizations  Religious Organization  crop general   Services 
35987,35.203522,-101.837743, Potter County Auditor  Government  Office  county taxation   Public Place 
36415,35.207628,-101.845753, Amarillo Hasler Postage Meters  Wholesale  Office Equipment  resume   Manufacturing & Wholesale Goods 
36916,35.207208,-101.840997, River Breaks Ranch L L C  Recreation    ranch legal   Entertainment 
36945,35.206588,-101.844676, Salon Downtown 618  Personal  Beauty Salon  communication   Services 
37064,35.210836,-101.844122, United Refrigeration Inc  Wholesale  Hardware  parts refrigerating   Manufacturing & Wholesale Goods 
37109,35.204441,-101.845154, Music Box  Personal  Tattoo Parlor  tattooing   Services 
37165,35.205772,-101.838463, Diamond Shamrock Credit  Professional  Computer Services  credit card   Services 
37198,35.205809,-101.837229, Blue Lights  Bars & Pubs    club night   Food & Drink 
37267,35.208836,-101.854751, AAA Roofing Co  Building & Trades  Construction  roofing contractor   Services 
37390,35.210575,-101.851201, Senior Financial Solutions  Banks & Credit Unions  Investment Brokerage  advisory financial   Services 
37438,35.210057,-101.846881, Big Sky Paint  Home & Garden  Building Materials  paint   Retail Goods 
37474,35.208781,-101.836796, Lx Cattle Company Inc  Farming  Livestock Farm  beef feedlot cattle   Manufacturing & Wholesale Goods 
37479,35.209741,-101.828843, Dal-Tile  Wholesale  Construction Materials  tile ceramic   Manufacturing & Wholesale Goods 
37891,35.204687,-101.846582, S & T Discount  Insurance  Insurance Agent  farm automobile parts   Services 
37984,35.204664,-101.83745, Randall L Sherrod Law Office  Professional  Lawyer & Legal Services  attorney   Services 
38270,35.199352,-101.846266, Casey Contracting  Building & Trades  Construction  contractor   Services 
38444,35.205812,-101.837381, North American Truck Wash Inc  Retail  Car Wash  carwash   Services 
38590,35.210891,-101.838086, Norflet Supply Inc  Wholesale  Hardware  parts refrigerating   Manufacturing & Wholesale Goods 
38648,35.20476,-101.846646, Transportation Consulting Inc  Freight    eating   Transportation 
38746,35.203608,-101.838886, Muscular Dystrophy Assn  Organizations  Professional Association  limousine   Services 
38939,35.205824,-101.831064, Amarillo City Risk Management  Government  Office  village   Public Place 
38954,35.207208,-101.840997, Qlo Crum Atty  Professional  Lawyer & Legal Services  appraiser   Services 
39295,35.206909,-101.838295, Gregg Bliss  Real Estate  Architect  educational material veterinarian   Services 
39363,35.19869,-101.840075, Evelyn's Hair Styling  Personal  Barber  maintenance   Services 
39889,35.212096,-101.846541, A To Z Tire & Battery  Autos & Motor Vehicles  Auto Supplies  tire   Retail Goods 
39959,35.202935,-101.840535, City Western Real Estate Agcy  Real Estate  Real Estate Agent  contractor   Services 
39981,35.199386,-101.846424, T E Pollard & Assoc  Professional  Engineering  engineer   Services 
40038,35.207249,-101.856297, Marcus Watkins  Utilities  Refuse  system   Services 
40083,35.211422,-101.8493, Public Steel Inc  Manufacturing  Metals  steel   Manufacturing & Wholesale Goods 
40140,35.211665,-101.843878, Bob Blinderman  Professional  Lawyer & Legal Services  attorney   Services 
40533,35.207727,-101.837001, Clay Dodson  Professional  Lawyer & Legal Services  attorney   Services 
40558,35.209661,-101.836543, Attorney General  Government  Court House  state counsel   Public Place 
40655,35.207975,-101.838237, Shannon Richardson  Retail  Photofinishing  laboratory   Services 
40838,35.207483,-101.844626, Rodney Thomas  Retail  Repair Shop  appliance   Services 
40981,35.20534,-101.843824, Bank Of Commerce  Banks & Credit Unions  Bank  association   Services 
40984,35.212158,-101.840052, Carter Chapel CME Church  Organizations  Religious Organization  oil   Services 
41095,35.207881,-101.855029, Wolfe Office Equipment Inc  Shopping    machine typewriter   Retail Goods 
41115,35.197921,-101.844049, Honorable John B Board  Government  Office  establishment   Public Place 
41252,35.210998,-101.846627, Heritage Door Co  Home & Garden  Furniture  automobile lubrication   Retail Goods 
41266,35.202181,-101.826662, Western Sales and Rentals  Home & Garden  Furniture  equipment   Retail Goods 
41319,35.20478,-101.846643, Versailles Add Amarillo H  Professional    bridge grading concrete asphalt contractor   Services 
41372,35.206353,-101.82846, Graphic Equipment & Supply  Wholesale  Machinery & Supplies  printer cartridge   Manufacturing & Wholesale Goods 
41391,35.206121,-101.842271, Area Agency Of Aging  Health Services  Clinic  home   Services 
41434,35.205685,-101.837249, Brewster's Pub  Restaurant    clinic   Food & Drink 
41632,35.209876,-101.836585, Enviro Tech  Building & Trades  Construction  tank removal   Services 
41670,35.209661,-101.836543, RIO Technical Svc Inc  Professional  Management & Consulting  consultant energy conservation   Services 
41763,35.207212,-101.850557, Cartridge Etc  Shopping  Computers & Home Electronics  carbon ribbon mfg   Retail Goods 
41782,35.197424,-101.840241, A D I Source  Real Estate  Architect  architectural   Services 
41819,35.205824,-101.831064, Keep Amarillo Beautiful  Government  Office  village   Public Place 
41940,35.201733,-101.831689, Bio Surge Inc  Manufacturing  Chemicals & Compounds  biological product   Manufacturing & Wholesale Goods 
42133,35.204536,-101.83747, Deja Voodoo Tattoo  Personal    therapist massage   Services 
42166,35.206344,-101.827182, Stanco Motors  Autos & Motor Vehicles  Automobile Sales  car dealer   Retail Goods 
42228,35.206544,-101.844877, Phoenix Environmental  Professional  Testing Lab  laboratory   Services 
42246,35.205824,-101.831064, Amarillo Legal Dept  Government  Office  village   Public Place 
42262,35.204601,-101.845182, Rio Grande Grill  Restaurant    eating   Food & Drink 
42440,35.205772,-101.838463, American Motgage  Banks & Credit Unions  Bank  mortgage   Services 
42554,35.203249,-101.842922, Spriggs Ronald T Law Offices  Professional  Lawyer & Legal Services  attorney   Services 
42563,35.209303,-101.841794, Jupe Industrial Brake & Spring  Wholesale  Auto Parts  equipment truck   Manufacturing & Wholesale Goods 
42602,35.205936,-101.838641, James R Gaut  Real Estate  Real Estate Agent  organization welfare   Services 
42757,35.205809,-101.839866, William H Bush Trust  Farming  Livestock Farm  ranch   Manufacturing & Wholesale Goods 
43052,35.206787,-101.839455, Wilson Fine Art  Professional    arts artist   Services 
43258,35.204997,-101.86412, Pollys Floor Covering  Home & Garden  Carpets & Floor Coverings  mfg   Retail Goods 
43362,35.204597,-101.846483, Boondocks  Restaurant    clinic   Food & Drink 
43455,35.206605,-101.844781, Decision One  Shopping  Computers & Home Electronics  tree   Retail Goods 
43513,35.202712,-101.831575, Parkhill Smith & Cooper Inc  Professional  Engineering  engineer   Services 
43557,35.204581,-101.845185, Music Box  Shopping  Gifts & Souvenirs  physician surgeon   Retail Goods 
43607,35.205772,-101.838463, Painting Contractor Education  Building & Trades  Construction  painter   Services 
43730,35.204742,-101.838774, Shiver-Megert & Associates LLP  Professional  Engineering  architectural   Services 
43846,35.20505,-101.849458, W Clint Barkley  Professional  Lawyer & Legal Services  attorney   Services 
43996,35.20127,-101.836914, Elliott-Russell Office Supls  Wholesale  Furniture  limb artificial braces mfg   Manufacturing & Wholesale Goods 
44066,35.197589,-101.841503, Curb Appeal Specialty Products  Retail  Repair Shop  ironwork   Services 
44074,35.206791,-101.847348, Southwest General Contractors  Building & Trades  Construction  industrial s management nonresidential   Services 
44159,35.203685,-101.846704, Amarillo Family Chiropractic  Health Services  Chiropractor  shop   Services 
44230,35.20505,-101.849434, Stephen M Naslund  Professional  Lawyer & Legal Services  infant wear   Services 
44255,35.205809,-101.839866, Brij and Associates LLC  Organizations  Community Association  environmental assessment   Services 
44458,35.206437,-101.843507, United Elevator Services  Building & Trades  Construction  equipment installation   Services 
44463,35.209876,-101.836585, Pinnacle Financial Group  Banks & Credit Unions  Investment Brokerage  advisory financial   Services 
44546,35.20707,-101.833377, Mc Connell & Tormey  Professional  Lawyer & Legal Services  attorney   Services 
44566,35.208028,-101.856153, A-1 Mobile Communications  Shopping    equipment telephone supply   Retail Goods 
44742,35.205809,-101.839866, Brother John Christian Cnslng  Social Services    counseling   Services 
45129,35.206728,-101.8384, Greg Phifer  Professional  Lawyer & Legal Services  attorney   Services 
45172,35.210244,-101.840241, Amarillo Fire Dept Admin  Government  Fire Station  department   Public Place 
45211,35.203538,-101.845358, Herring Insurance Agency  Insurance  Insurance Agent  ambulance   Services 
45238,35.207519,-101.852864, Renova Iglesia Intern  Organizations  Religious Organization  church   Services 
45320,35.206728,-101.8384, Eric S Coats Atty  Professional  Lawyer & Legal Services  day   Services 
45336,35.210044,-101.846725, Gpr Moving & Storage  Retail  Repair Shop  local storage truck   Services 
45345,35.209661,-101.836543, Hanover Compressor Co  Wholesale  Machinery & Supplies  compressor gas   Manufacturing & Wholesale Goods 
45488,35.205809,-101.839866, Gower & Co  Insurance  Insurance Agent  accident   Services 
45735,35.204664,-101.83745, Insurance Management Svc  Insurance  Health Insurance  plan   Services 
45814,35.205936,-101.838641, Ben Batemen  Professional  Lawyer & Legal Services  attorney   Services 
45830,35.203775,-101.839063, Amarillo Blueprint Co  Professional  Printing & Photocopies  blueprinting   Services 
45885,35.206635,-101.837061, Indian Ink Leasing Inc  Building & Trades  Equipment Rental  leasing   Services 
45922,35.204201,-101.842805, Lupe's Bail Bond  Insurance  Hazard Insurance  bond   Services 
45955,35.205553,-101.837346, Amarillo Comedy Club  Arts & Performance  Theater  entertainer business   Entertainment 
45959,35.209441,-101.841848, Texas Bearing Co Of Amarillo  Wholesale  Machinery & Supplies  bearing   Manufacturing & Wholesale Goods 
46126,35.207477,-101.851459, Shirt F X  Shopping  Clothing  Apparel  & Fashions  personal institution   Retail Goods 
46794,35.207283,-101.842024, C & R Automotive  Retail  Auto Repair  general   Services 
46945,35.203608,-101.838886, Affordable Escorts  Personal  Adult  escort   Services 
46956,35.203608,-101.838886, Panhandle Foundation Repair  Building & Trades  Construction  foundation   Services 
47051,35.202117,-101.843218, Plains Builders Job  Building & Trades  Construction  contractor   Services 
47063,35.205824,-101.831064, Amarillo Accounting  Government  Office  village   Public Place 
47210,35.205812,-101.837381, Outreach Health Care Inc  Health Services  Clinic  home care   Services 
47431,35.197073,-101.836808, Outstanding Amarillo  Organizations  Non-profit Organization  lesbian gay   Services 
47456,35.205812,-101.837381, U S Security Assoc Inc  Professional  Detective & Security Services  car guard patrol   Services 
47488,35.20851,-101.827804, Bob Goree Auctioneers  Professional  Business Services  auctioneer   Services 
47525,35.205936,-101.838641, Wheeler & Assoc  Insurance  Insurance Agent  hanging contractor   Services 
47982,35.206728,-101.8384, Bank One  Banks & Credit Unions  Bank  product   Services 
47997,35.205809,-101.839866, True & Schrandt PC  Professional  Lawyer & Legal Services  attorney   Services 
48020,35.209661,-101.836543, Hancock & Canada  Professional  Lawyer & Legal Services  attorney   Services 
48101,35.199386,-101.846424, Kiker Promotional Products  Professional  Advertising  counselor   Services 
48162,35.207661,-101.852804, Twin Cities Communications  Wholesale  Electrical  radio   Manufacturing & Wholesale Goods 
48190,35.205977,-101.855723, Ability Movers  Freight    mover   Transportation 
48203,35.209876,-101.836585, Saint Anthonys Fitness Center  Health Services  Hospital  general   Services 
